title,link,premium,subhead,byline,image_url,article_type
"Marine Le Pen, phoenix of French far right, embarks on Elysée race",https://www.lemonde.fr/en/politics/article/2026/07/08/marine-le-pen-phoenix-of-french-far-right-embarks-on-elysee-race_6755261_5.html,Subscribers only,Marine Le Pen announced she would run for president hours after her embezzlement conviction was upheld.,,https://img.lemde.fr/2026/07/06/0/6/6132/4088/400/266/75/0/7197527_upload-1-0zn5tcikuv9k-zum1320d14.jpg,
Two Israeli NGOs warn of a 'de facto annexation at an unprecedented pace' in the West Bank,https://www.lemonde.fr/en/international/article/2026/07/08/two-israeli-ngos-warn-of-a-de-facto-annexation-at-an-unprecedented-pace-in-the-west-bank_6755253_4.html,Subscribers only,,,https://img.lemde.fr/2026/07/06/240/0/5760/3840/398/265/75/0/8634809_upload-1-uk1xknyly443-lgeai-routes-colonisation-67.jpg,
Macron expresses 'belief that a new era is dawning in Syria' in Damascus visit,https://www.lemonde.fr/en/international/article/2026/07/08/macron-expresses-belief-that-a-new-era-is-dawning-in-syria-in-damascus-visit_6755266_4.html,Subscribers only,,,https://img.lemde.fr/2026/07/07/0/0/7672/5114/398/265/75/0/d2d21b6_upload-1-uwrjnyjynggq-dsc-6622.jpg,
"On day 1 of summit in Ankara, NATO unveils defense contracts worth billions",https://www.lemonde.fr/en/international/article/2026/07/08/on-the-first-day-of-the-nato-summit-in-ankara-rutte-unveils-a-wave-of-defense-contracts-worth-billions-of-euros_6755255_4.html,Subscribers only,"The exact amount, around €43 billion, is set to be announced Wednesday by the secretary general of the alliance. The goal is to demonstrate to US President Donald Trump, who arrived Tuesday afternoon in the Turkish capital, that Europe and Canada are making massive investments in their defense.",,https://img.lemde.fr/2026/07/07/0/0/5500/3666/398/265/75/0/1297d75_ftp-1-vyrtbe0tqafp-2026-07-07t101522z-1934421449-rc2y8maco7a1-rtrmadp-3-nato-summit-defence.JPG,
Péter Magyar launches contested procedure to remove Hungary's president,https://www.lemonde.fr/en/international/article/2026/07/08/peter-magyar-launches-contested-procedure-to-remove-hungary-s-president_6755258_4.html,Subscribers only,"On July 7, the Hungarian parliament began to review a package of constitutional amendments that would remove President Tamas Sulyok, an ally of former prime minister Viktor Orban. This 'forceful' approach has drawn concern from several NGOs and advocates for the rule of law.",,https://img.lemde.fr/2026/07/02/0/0/4361/2907/398/265/75/0/1f8232a_ftp-1-sh7upy6rczdt-2026-07-02t103223z-1746633144-rc2tzlayeegh-rtrmadp-3-hungary-politics.JPG,
"Albert Camus archives, including manuscripts, forged documents and letters, join national collection",https://www.lemonde.fr/en/culture/article/2026/07/08/albert-camus-archives-including-manuscripts-forged-documents-and-letters-join-national-collection_6755257_30.html,Subscribers only,"The archives, previously kept within the writer's family, has been acquired by France's national library for €9 million with support from Hermès and CIC.",,https://img.lemde.fr/2026/07/03/0/0/4252/2834/398/265/75/0/24ccf66_upload-1-v0ysbthwwcoo-cre-dit-photo-mc-sipa-tristan-reynaud-e-ditions-gallimard-13.jpg,
Five questions to understand the consequences of Marine Le Pen's appeal to France's highest court,https://www.lemonde.fr/en/politics/article/2026/07/08/five-questions-to-understand-the-consequences-of-marine-le-pen-s-appeal-to-france-s-highest-court_6755265_5.html,Subscribers only,"Hours after being convicted, the far-right leader said she would run for president in 2027 and campaign without wearing an electronic monitor. Here's what that claim would actually require.",Laura Motet,https://img.lemde.fr/2026/07/07/0/4/2952/1968/664/442/75/0/31f00c7_ftp-1-npl7gwrpk0zq-2026-07-07t183030z-725717043-rc259ma4ago7-rtrmadp-3-france-politics-le-pen.JPG,Round-up
US-Iran ceasefire is 'over' for Trump after overnight strikes in Strait of Hormuz,https://www.lemonde.fr/en/international/article/2026/07/07/us-launches-new-strikes-on-iran-after-hormuz-attacks_6755250_4.html,,,,https://img.lemde.fr/2026/07/08/0/0/8001/5334/198/132/95/0/3b6cdfb_ftp-1-zbe6a9jtdbaj-a0e3eefa05654de9a409b93e90e2d8de-0-18e46217342c4ee3b5729cc124e780d8.jpg,
Images of US strikes on Iran in response to new attacks in Strait of Hormuz,https://www.lemonde.fr/en/videos/video/2026/07/08/video-us-strikes-iran-in-response-to-new-attacks-in-strait-of-hormuz_6755263_108.html,,,,https://img.lemde.fr/2026/07/08/399/934/1122/748/198/132/95/0/6ffbb18_ftp-1-0dlhftm7utgm-5565809-01-06.jpg,
"Explosions in Damascus during Macron's visit, one person killed and 36 injured",https://www.lemonde.fr/en/syria/article/2026/07/08/explosions-in-damascus-during-macron-s-visit-one-person-killed-and-36-injured_6755267_229.html,,,,https://img.lemde.fr/2026/07/07/0/0/6000/4000/198/132/95/0/70410bb_ftp-1-ivqtzcpyiapx-0ea9d07e7a4e46e9ba59a022b19d7775-3-72254cc13e204ea694230c3f2224e5a7.jpg,
"French government's plan against racism, antisemitism and discrimination not ambitious enough, activits say",https://www.lemonde.fr/en/france/article/2026/07/08/french-government-s-plan-against-racism-antisemitism-and-discrimination-not-ambitious-enough-activits-say_6755260_7.html,Subscribers only,,,https://img.lemde.fr/2026/07/06/0/0/7614/5076/198/132/95/0/3ea7cb3_ftp-1-324satomgo15-5550384-01-06.jpg,
Quebec's 'moving day' is overshadowed by housing crisis,https://www.lemonde.fr/en/international/article/2026/07/08/in-quebec-moving-day-overshadowed-by-housing-crisis_6755252_4.html,Subscribers only,,,,
Hope of finding survivors after Venezuela quakes give way to mourning,https://www.lemonde.fr/en/international/article/2026/07/08/in-venezuela-hope-of-finding-survivors-after-the-twin-earthquakes-gives-way-to-mourning_6755256_4.html,Subscribers only,,,,
2026 World Cup: Switzerland beats Colombia on penalties to reach quarter-finals,https://www.lemonde.fr/en/sports/article/2026/07/08/2026-world-cup-switzerland-beat-colombia-on-penalties-to-reach-quarter-finals_6755254_9.html,,,,,
Ireland passes bill banning imports of goods from Israeli settlements,https://www.lemonde.fr/en/international/article/2026/07/08/ireland-passes-bill-banning-imports-of-goods-from-israeli-settlements_6755251_4.html,,,,,
"Farage to resign as MP, force by-election amid financial scrutiny",https://www.lemonde.fr/en/international/article/2026/07/07/farage-to-resign-as-mp-force-by-election-amid-financial-scrutiny_6755240_4.html,,,,,
"PFAS: Less than 2% of emissions could be removed from environment, even with massive investments",https://www.lemonde.fr/en/les-decodeurs/article/2026/07/07/pfas-less-than-2-of-emissions-could-be-removed-from-environment-even-with-massive-investments_6755238_8.html,Subscribers only,,,,
How Malian jihadists and pro-independence groups joined forces to overthrow the junta,https://www.lemonde.fr/en/le-monde-africa/article/2026/07/07/how-malian-jihadists-and-pro-independence-groups-joined-forces-to-overthrow-the-junta_6755235_124.html,Subscribers only,,,,
French prosecutors open probe into Paraguay senator's racist abuse of Mbappé,https://www.lemonde.fr/en/sports/article/2026/07/07/french-prosecutors-open-probe-into-paraguay-senator-s-racist-abuse-of-mbappe_6755239_9.html,,,,,
Book reveals Trump's improvisation and concentration of power,https://www.lemonde.fr/en/international/article/2026/07/07/regime-change-book-reveals-trump-s-improvisation-and-concentration-of-power_6755245_4.html,Subscribers only,"Two journalists from the 'New York Times' retrace the early months of the US president's second term, highlighting the ruptures and upheavals his approach to power has unleashed.",Piotr Smolar,https://img.lemde.fr/2026/07/05/0/0/5570/3713/664/442/75/0/0e6abbd_ftp-1-ywte7v9gu3s4-5537976-01-06.jpg,Review
Pyrénées wildfires destroy everything in their path: 'I didn't think I'd make it out alive',https://www.lemonde.fr/en/environment/article/2026/07/07/pyrenees-wildfires-destroy-everything-in-their-path-i-didn-t-think-i-d-make-it-out-alive_6755229_114.html,Subscribers only,"The residents of Ille-sur-Têt, a town that was evacuated, remain in shock as the Trévillach wildfire – the largest the region has seen in 50 years – was still not under control on Monday evening.",Maryline Baumard,https://img.lemde.fr/2026/07/06/0/0/3040/2026/664/442/75/0/e44d672_ftp-1-5lziq3ravrui-2026-07-06t174010z-1293887667-rc2h8ma1xq0l-rtrmadp-3-europe-weather-france-wildfire.JPG,Feature
One hundred early works by Claude Monet reunited at Le Havre's André Malraux Museum,https://www.lemonde.fr/en/culture/article/2026/07/07/one-hundred-early-works-by-claude-monet-reunited-at-le-havre-s-andre-malraux-museum_6755219_30.html,Subscribers only,"The MuMa exhibition, showcasing drawings, caricatures and paintings, places the painter in his family and regional context.",Harry Bellet,https://img.lemde.fr/2026/07/02/5103/0/3314/2209/664/442/75/0/307a862_upload-1-6ty12huifivr-31-claude-monet-le-jardinier-de-graville-carnet-de-dessins-n-2-coll-part-franc-ois-doury.jpg,Review
'The UAE does not want its strategic partnership with Israel to depend on Benjamin Netanyahu',https://www.lemonde.fr/en/international/article/2026/07/07/the-uae-does-not-want-its-strategic-partnership-with-israel-to-depend-on-benjamin-netanyahu_6755237_4.html,Subscribe,,,https://img.lemde.fr/2023/07/31/0/0/0/0/100/100/60/0/d45bb07_1690791602941-eac5c14-1647333440018-jean-pierre-filiu-2019.jpg,Column
Pope Leo XIV's reminder of the duty of humanity toward migrants,https://www.lemonde.fr/en/opinion/article/2026/07/06/pope-leo-xiv-s-reminder-of-the-duty-of-humanity-toward-migrants_6755201_23.html,,,,,Editorial
Climate change: 'We cannot meet the challenge of adapting housing with the tools of the past. A thorough overhaul is needed',https://www.lemonde.fr/en/economy/article/2026/07/04/climate-change-we-cannot-meet-the-challenge-of-adapting-housing-with-the-tools-of-the-past-a-thorough-overhaul-is-needed_6755153_19.html,Subscribe,,,,Interview
