title,link,premium,subhead,byline,image_url,article_type
"Paris Mayor Grégoire on the climate crisis: 'To adapt together, we need to change our way of life'",https://www.lemonde.fr/en/politics/article/2026/06/25/paris-mayor-gregoire-on-the-climate-crisis-to-adapt-together-we-need-to-change-our-way-of-life_6754853_5.html,Subscribers only,"In an interview with Le Monde, the Socialist leader of the French capital city called individual air conditioning 'a scourge' and urged 'flexibility' and 'makeshift solutions' to respond to the urgent challenge of heat waves.",,https://img.lemde.fr/2026/05/27/667/0/5000/3333/400/266/75/0/04b2959_upload-1-ppa7uoxr3rd3-kzihnioglu-paris-pol-canicule-gregoire-emmanuel-27052026-34.jpg,
Venezuela reels after deadliest double earthquake in 126 years,https://www.lemonde.fr/en/environment/article/2026/06/25/venezuela-reels-after-deadliest-double-earthquake-in-126-years_6754858_114.html,Subscribers only,,,https://img.lemde.fr/2026/06/25/0/0/6192/4128/398/265/75/0/d650c78_ftp-1-p5or2tdwlx9h-5434315-01-06.jpg,
Ukrainian strikes on Russian refineries are triggering shortages and rising discontent,https://www.lemonde.fr/en/international/article/2026/06/25/ukrainian-strikes-on-russian-refineries-are-triggering-shortages-and-rising-discontent_6754849_4.html,Subscribers only,,,https://img.lemde.fr/2026/06/24/0/102/2571/1714/398/265/75/0/29852a9_upload-1-13imnskz6rwt-capture-d-e-cran-2026-06-24-a-16-24-03.png,
France's public debt soars above €3.5 trillion,https://www.lemonde.fr/en/politics/article/2026/06/25/france-s-public-debt-soars-above-3-5-trillion_6754865_5.html,Subscribers only,"France's debt reached €3.536 trillion at the end of March, the national statistics agency said on Thursday. This amounts to 117.5% of GDP, nearly as high as it was after the Covid-19 pandemic, and the increase shows no sign of slowing down.",,https://img.lemde.fr/2026/06/25/1/0/7488/4992/398/265/75/0/006db93_upload-1-w4kjg3zwm86w-000-434g7wd.jpg,
EU-US trade deal to take effect before Trump's deadline,https://www.lemonde.fr/en/economy/article/2026/06/25/eu-us-trade-deal-to-take-effect-before-trump-s-deadline_6754857_19.html,,"Struck between the US president and EU chief Ursula von der Leyen in July 2025, the deal sets levies of 15% on most of EU exports to the United States and zero tariffs for US industrial goods coming into the 27-nation bloc.",,https://img.lemde.fr/2026/06/17/0/19/5961/3974/398/265/75/0/31a11a3_ftp-1-9zhev69of19m-2026-06-17t141752z-112219645-rc2yykae25dg-rtrmadp-3-eu-energy-grids-funding.JPG,
Trumpism gains ground in Latin America,https://www.lemonde.fr/en/opinion/article/2026/06/25/trumpism-gains-ground-in-latin-america_6754859_23.html,,The recent electoral successes of the far right in Peru and Colombia bolster the view that the ideas of US President Donald Trump are resonating in the region and that his influence continues to grow. But trade figures show that Beijing has filled the void left by Washington over several years.,,https://img.lemde.fr/2025/12/15/2183/0/3648/2432/398/265/75/0/e01da57_ftp-1-ljrkai3rdich-5684427-01-06.jpg,Editorial
Trump uses the United States's 250th anniversary celebrations to celebrate himself,https://www.lemonde.fr/en/international/article/2026/06/25/trump-uses-the-united-states-s-250th-anniversary-celebrations-to-celebrate-himself_6754856_4.html,Subscribers only,"The president kicked off the festivities on Wednesday evening in Washington at a gathering that resembled a campaign rally, adopting an approach that equated American patriotism with a cult of personality.",Piotr Smolar,https://img.lemde.fr/2026/06/25/59/0/5912/3941/664/442/75/0/08d8ac7_ftp-1-ggmepmpwe5pc-5432730-01-06.jpg,News
Three-year-old found dead in car in Paris region during France heatwave,https://www.lemonde.fr/en/france/article/2026/06/25/three-year-old-found-dead-in-car-in-paris-region-during-france-heatwave_6754860_7.html,,,,https://img.lemde.fr/2026/06/24/1/0/7490/4993/198/132/95/0/b4b830e_ftp-1-etuvaak2gt3a-5427074-01-06.jpg,
France intercepts suspected Russia-linked oil tanker off the coast of Sicily,https://www.lemonde.fr/en/international/article/2026/06/25/france-intercepts-suspected-russia-linked-oil-tanker-off-the-coast-of-sicily_6754864_4.html,,,,https://img.lemde.fr/2026/06/25/0/412/2568/1712/198/132/95/0/9e40c2b_upload-1-gqibc4fkrzft-capture-d-e-cran-2026-06-25-a-12-21-43.png,
"By putting a French flag or Eiffel Tower on products, 'Frenchwashing' blurs lines over origin",https://www.lemonde.fr/en/economy/article/2026/06/25/by-putting-a-french-flag-or-eiffel-tower-on-products-frenchwashing-blurs-lines-over-origin_6754850_19.html,Subscribers only,,,https://img.lemde.fr/2026/05/28/1/0/7647/5098/198/132/95/0/5701b26_ftp-1-tphj3huqp2im-2026-05-28t205634z-460526851-rc2gilarr42m-rtrmadp-3-europe-weather-france-heat.JPG,
China remains on the sidelines of the World Cup,https://www.lemonde.fr/en/international/article/2026/06/25/china-remains-on-the-sidelines-of-the-world-cup_6754848_4.html,Subscribers only,,,https://img.lemde.fr/2026/06/21/0/0/8379/5586/198/132/95/0/f8d5962_ftp-1-lzjnys2ysrl7-5e7dfa9f97d54aa6aa02319dcb89cc0e-0-bc4636bad55f4f18bb8f991dcf861d07.jpg,
"France records its hottest day ever, with relief on the horizon",https://www.lemonde.fr/en/environment/article/2026/06/25/france-records-its-hottest-day-with-relief-on-the-horizon_6754845_114.html,Subscribers only,,,,
"EU says Amazon, Microsoft cloud services should face stricter rules",https://www.lemonde.fr/en/pixels/article/2026/06/25/eu-says-amazon-microsoft-cloud-services-should-face-stricter-rules_6754866_13.html,,,,,
'The special tribunal on the aggression against Ukraine could be a major step toward protecting the legal architecture built after World War II',https://www.lemonde.fr/en/international/article/2026/06/25/the-special-tribunal-on-ukraine-s-aggression-could-be-a-major-step-toward-protecting-the-legal-architecture-built-after-world-war-ii_6754844_4.html,Subscribers only,,,,
250 years of American independence: A groundbreaking Constitution for 'a more perfect union',https://www.lemonde.fr/en/international/article/2026/06/24/250-years-of-american-independence-a-groundbreaking-constitution-for-a-more-perfect-union_6754840_4.html,Subscribers only,,,,
New York Mayor Mamdani cements his hold on power after three of his candidates win Democratic primaries,https://www.lemonde.fr/en/international/article/2026/06/24/new-york-mayor-mamdani-cements-his-hold-on-power-after-three-of-his-candidates-win-democratic-primaries_6754841_4.html,Subscribers only,,,,
Heatwave puts French workers in harsh conditions: 'We have to keep our sleeveless fleece vests on so we're recognizable',https://www.lemonde.fr/en/economy/article/2026/06/24/heatwave-puts-french-workers-in-harsh-conditions-we-have-to-keep-our-sleeveless-fleece-vests-on-so-we-re-recognizable_6754829_19.html,Subscribers only,,,,
Resistance fighter Marc Bloch inducted into Panthéon in moving moment of republican solidarity,https://www.lemonde.fr/en/politics/article/2026/06/24/french-resistance-fighter-marc-bloch-inducted-into-pantheon-in-moving-moment-of-republican-solidarity_6754823_5.html,Subscribers only,,,,
The unavoidable rise of a less American world,https://www.lemonde.fr/en/international/article/2026/06/24/the-unavoidable-rise-of-a-less-american-world_6754817_4.html,Subscribers only,,,,
"Heatwave in France spells uncertainty for several EDF nuclear reactors, but RTE says the overall grid is secure",https://www.lemonde.fr/en/economy/article/2026/06/24/heatwave-in-france-spells-uncertainty-for-several-edf-nuclear-reactors-but-rte-says-the-overall-grid-is-secure_6754812_19.html,Subscribers only,"France's state-owned electric utility company has shut down one nuclear reactor and reduced the output of two others. Although the extreme heat is increasing electricity demand, France has enough capacity to meet it, according to the national power grid operator.",Adrien Pécout,https://img.lemde.fr/2026/06/23/0/0/8256/5504/664/442/75/0/be2ce9b_ftp-1-hqs7kbtxzdsh-5413254-01-06.jpg,In Depth
France's public pools need urgent renovation: 'What would we do without them? We wouldn't make it',https://www.lemonde.fr/en/france/article/2026/06/23/france-s-public-pools-need-urgent-renovation-what-would-we-do-without-them-we-wouldn-t-make-it_6754772_7.html,Subscribers only,"Aging, energy-intensive and expensive for rural towns to maintain, many aquatic centers in the countryside have been shutting down. Yet these facilities provide equal access for people to cool off and learn to swim. An MP recently sounded the alarm about the worrying situation facing these essential local public services.",Camille Bordenet,https://img.lemde.fr/2026/06/18/1/0/4000/2666/664/442/75/0/454f930_upload-1-rdhh1ttuqsbu-mahka-eslami-piscine-municipale-de-cha-teauneuf-sur-sarthe092.jpg,Feature
France faces unprecedented heatwave: 'We are about to experience four of the hottest days ever recorded in the country',https://www.lemonde.fr/en/environment/article/2026/06/23/france-faces-unprecedented-heatwave-we-are-about-to-experience-four-of-the-hottest-days-ever-recorded-in-the-country_6754769_114.html,Subscribers only,"A prolonged heatwave, rather than a brief spike, has arrived. Unusually high temperatures are set to persist across the country until at least the end of this week, exposing more than 90% of the French population to extreme and rare heat.",Audrey Garric,https://img.lemde.fr/2026/06/21/0/0/8256/5504/664/442/75/0/eb3dc08_upload-1-thvr7s5jr97f-caniculehd-22.jpg,In Depth
Heeding Resistance fighter Marc Bloch's warning against 'strange defeats',https://www.lemonde.fr/en/opinion/article/2026/06/24/heeding-resistance-fighter-marc-bloch-s-warning-against-strange-defeats_6754836_23.html,,,,,Editorial
Flagrant unpreparedness to heatwaves highlights urgent need for climate anticipation in France,https://www.lemonde.fr/en/opinion/article/2026/06/22/flagrant-unpreparedness-to-heatwaves-highlights-urgent-need-for-climate-anticipation-in-france_6754743_23.html,,,,,Editorial
"'In Iran, none of the causes that sparked the relentless and admirable anti-regime uprisings has disappeared'",https://www.lemonde.fr/en/opinion/article/2026/06/19/in-iran-none-of-the-causes-that-sparked-the-relentless-and-admirable-anti-regime-uprisings-has-disappeared_6754655_23.html,Subscribe,,,https://img.lemde.fr/2025/02/13/0/0/0/0/100/100/60/0/012c520_sirius-fs-upload-1-siebgildln9p-1739442624103-capture-da-a-cran-2025-02-13-112806.png,Column
