title,link,premium,subhead,byline,image_url,article_type
A show of strength from Ukrainian society,https://www.lemonde.fr/en/opinion/article/2026/07/24/a-show-of-strength-from-ukrainian-society_6755794_23.html,,"The spontaneous mobilization of Ukrainians, who took to the streets to voice their anger over the dismissal of their defense minister despite relentless Russian strikes, paid off. The country's cohesion ultimately prevailed, while a prolonged crisis would have weakened Ukraine's standing with its allies.",,https://img.lemde.fr/2026/07/20/0/0/5847/3898/400/266/75/0/82f1997_ftp-1-bay32mohlm6s-5669975-01-06.jpg,
Tariffs: Trump pursues his trade war through every method available,https://www.lemonde.fr/en/economy/article/2026/07/24/tariffs-trump-pursues-his-trade-war-through-every-method-available_6755786_19.html,Subscribers only,,,https://img.lemde.fr/2026/06/03/0/0/5139/3426/398/265/75/0/670e413_upload-1-yqnwfoj0vyc5-063-2276411934.jpg,
"After two diplomats were violently detained in Tehran, France expresses concern for its nationals in Iran",https://www.lemonde.fr/en/international/article/2026/07/24/after-two-diplomats-were-violently-detained-in-tehran-france-expresses-concern-for-its-nationals-in-iran_6755780_4.html,Subscribers only,,,https://img.lemde.fr/2026/07/22/0/0/5748/3832/398/265/75/0/c2efd88_ftp-1-c8cd5o33nbee-2026-07-22t104253z-435315505-rc2yimap6h4i-rtrmadp-3-france-politics.JPG,
US unveils new tariffs on 60 partners as Trump rebuilds trade agenda,https://www.lemonde.fr/en/international/article/2026/07/24/us-unveils-new-tariffs-on-60-partners-as-trump-rebuilds-trade-agenda_6755776_4.html,,"The levies, effective Friday, range from 10% to 12.5% and impact major economies like China, India and the EU. Earlier this week, the US president also ordered new 50% tariffs on many Canadian products, citing Ottawa's 'discriminatory treatment' of American products including alcohol and automobiles.",,https://img.lemde.fr/2026/07/21/0/0/3840/2560/398/265/75/0/3b442b7_ftp-1-ix9hmvytupu2-5677193-01-06.jpg,
Bab Al-Mandab Strait threatens to be new front in war with Iran,https://www.lemonde.fr/en/international/article/2026/07/24/bab-al-mandab-strait-threatens-to-be-new-front-in-war-with-iran_6755785_4.html,Subscribers only,"The Houthi forces, who announced a blockade of Saudi ports on Monday, claimed responsibility for an attack in the Red Sea targeting two Saudi Arabian oil tankers on Wednesday. Iran and the Houthis are betting that the economic consequences of the war will bring Donald Trump back to the negotiating table.",,https://img.lemde.fr/2026/07/23/0/0/6720/4480/398/265/75/0/ebf5eee_ftp-1-b5kmpzzod7qd-2026-07-23t132251z-1737362783-rc20hkargega-rtrmadp-3-iran-crisis-stocks.JPG,
My life as a Russian exile in Paris: 'France is an improved version of the USSR',https://www.lemonde.fr/en/summer-reads/article/2026/07/24/my-life-as-a-russian-exile-in-paris-france-is-an-improved-version-of-the-ussr_6755784_183.html,Subscribers only,"'A Russian in Paris' (2/6). After arriving in France in 2022, journalist Elizaveta Osetinskaya settled in Paris' 16th arrondissement. She especially praises the French school system, which her daughter Bella now benefits from.",,https://img.lemde.fr/2026/07/16/550/0/1850/1233/398/265/75/0/2f4e73f_upload-1-ty42grvy6jrq-episode-2-e-cole.jpg,
"Wildfires in southern France: 'The anxiety comes afterward, when we see the scorched landscape'",https://www.lemonde.fr/en/environment/article/2026/07/24/wildfires-in-southern-france-the-anxiety-comes-afterward-when-we-see-the-scorched-landscape_6755789_114.html,Subscribers only,"Fires are raging in southwestern France, including a blaze that began on Wednesday, which forced the precautionary evacuation of 20,000 people, destroyed six houses and devastated everything along a stretch of some 10 kilometers.",Maryline Baumard,https://img.lemde.fr/2026/07/23/0/0/5878/3919/664/442/75/0/8a1830a_ftp-1-fgjzfs0jawlw-5686434-01-06.jpg,Feature
EU accuses TikTok of failing to protect children,https://www.lemonde.fr/en/international/article/2026/07/24/eu-accuses-tiktok-of-failing-to-protect-children_6755790_4.html,,,,https://img.lemde.fr/2025/07/10/0/0/7720/5147/198/132/95/0/d157cd7_ftp-import-images-1-17oc2dw6kwks-5379668-01-06.jpg,
Four Palestinians and one Israeli killed in West Bank,https://www.lemonde.fr/en/international/article/2026/07/24/four-palestinians-and-one-israeli-killed-in-west-bank_6755788_4.html,,,,https://img.lemde.fr/2026/07/24/1/0/8192/5461/198/132/95/0/e8defdb_ftp-1-1he35himvkdg-5693536-01-06.jpg,
Bastia Museum exhibition traces migratory history between Corsica and Maghreb,https://www.lemonde.fr/en/culture/article/2026/07/24/in-bastia-the-corsica-maghreb-exhibition-explores-the-migratory-connections-between-the-island-and-north-africa_6755781_30.html,Subscribers only,,,https://img.lemde.fr/2026/07/22/1122/0/4280/2853/198/132/95/0/493d8b7_upload-1-6cfmc3ojxxxl-img-5756-4.jpg,
Germany's Merz reshuffles top government posts,https://www.lemonde.fr/en/international/article/2026/07/24/germany-s-merz-reshuffles-top-government-posts_6755792_4.html,,,,https://img.lemde.fr/2026/07/24/0/0/7012/4674/198/132/95/0/3e23e52_ftp-1-ya9tqjrvxy0z-0b73f320e661408785536f87d8f04377-0-596c34ee76484140b17e2dded75779d6.jpg,
"Overrun with tourists, Annecy attempts to steer visitors away from its overcrowded lake and old town",https://www.lemonde.fr/en/economy/article/2026/07/24/overrun-with-tourists-annecy-attempts-to-steer-them-away-from-its-overcrowded-lake-and-old-town_6755778_19.html,Subscribers only,,,,
UNESCO adds West Bank site and Lebanese castles to World Heritage List,https://www.lemonde.fr/en/international/article/2026/07/24/unesco-adds-west-bank-site-and-lebanese-castles-to-world-heritage-list_6755793_4.html,,,,,
Salman Rushdie testifies at knife attacker's US trial on terrorism charges,https://www.lemonde.fr/en/international/article/2026/07/24/salman-rushdie-testifies-at-knife-attacker-s-us-trial-on-terrorism-charges_6755782_4.html,,,,,
The mysterious horse-shaped geoglyph England has been maintaining for thousands of years,https://www.lemonde.fr/en/m-le-mag/article/2026/07/23/the-mysterious-horse-shaped-geoglyph-england-has-been-maintaining-for-thousands-of-years_6755772_117.html,Subscribers only,,,,
"European Commission fines Google €890 million, risking Trump's ire",https://www.lemonde.fr/en/economy/article/2026/07/23/european-commission-fines-google-890-million-risking-trump-s-ire_6755767_19.html,Subscribers only,,,,
"In the West Bank, a Palestinian hamlet faces relentless harassment by settlers",https://www.lemonde.fr/en/international/article/2026/07/23/in-the-west-bank-a-palestinian-hamlet-faces-relentless-harassment-by-settlers_6755770_4.html,Subscribers only,,,,
Chanel's XXL cruise ship in May 2018,https://www.lemonde.fr/en/summer-reads/article/2026/07/23/chanel-s-xxl-cruise-ship-in-may-2018_6755775_183.html,Subscribers only,,,,
Paris prosecutors open investigation into 'libertine' social network Wyylde,https://www.lemonde.fr/en/pixels/article/2026/07/23/paris-prosecutors-open-investigation-into-libertine-social-network-wyylde_6755761_13.html,Subscribers only,,,,
How Macron narrowly averted his environment minister's resignation,https://www.lemonde.fr/en/politics/article/2026/07/23/how-macron-narrowly-averted-his-environment-minister-s-resignation_6755750_5.html,Subscribers only,"Monique Barbut, who said she intended to quit the government on Tuesday, July 21, after an agricultural law she contested was adopted, ended up staying on in her role on Wednesday. The twist added a colorful note to the political crisis.",Nathalie Segaunes,https://img.lemde.fr/2026/07/22/0/4/2952/1968/664/442/75/0/241173d_ftp-1-okw4377qplrw-2026-07-22t100059z-107944366-rc2yimadcql6-rtrmadp-3-france-politics.JPG,In Depth
"How social media bans for young users, now in effect in France, have spread worldwide",https://www.lemonde.fr/en/pixels/article/2026/07/22/how-social-media-bans-for-young-users-now-in-effect-in-france-have-spread-worldwide_6755718_13.html,Subscribers only,France has decided to ban those under 15 from major platforms such as Instagram and TikTok. The country is following a global trend that has gained momentum in recent years.,Florian Reynaud,https://img.lemde.fr/2026/07/21/0/0/3000/2000/664/442/75/0/787e78b_upload-1-tiqvpb9bqo0v-illustration-sans-titre-35-1.jpg,In Depth
My life as a Russian exile in Paris: 'You can't fight French bureaucracy',https://www.lemonde.fr/en/summer-reads/article/2026/07/23/my-life-as-a-russian-exile-in-paris-you-can-t-fight-french-bureaucracy_6755746_183.html,Subscribers only,"'A Russian in Paris' (1/6). Journalist Elizaveta Osetinskaya, who came to France in 2022 because of her opposition to the war in Ukraine, describes the difficulties she has faced with the prefecture while barely speaking the language.",Elizaveta Osetinskaya,https://img.lemde.fr/2026/07/22/296/0/1850/1233/664/442/75/0/eb751a9_upload-1-ct68mxdtxy5i-russieok.jpg,Series
'Can we continue to entrust global sport to organizations more concerned with their financial interests than with the public good?',https://www.lemonde.fr/en/opinion/article/2026/07/19/can-we-continue-to-entrust-global-sport-to-organizations-more-concerned-with-their-financial-interests-than-with-the-public-good_6755619_23.html,Subscribe,,,,Op-Ed
The profile of France's new defender of rights raises concern,https://www.lemonde.fr/en/opinion/article/2026/07/23/the-profile-of-france-s-new-defender-of-rights-raises-concern_6755763_23.html,,,,,Editorial
China's AI doctrine is a challenge for Europe,https://www.lemonde.fr/en/opinion/article/2026/07/21/china-s-ai-doctrine-is-a-challenge-for-europe_6755686_23.html,,,,,Editorial
