title,link,premium,subhead,byline,image_url,article_type
Le Monde's point-by-point breakdown of the fragile US-Iran framework agreement,https://www.lemonde.fr/en/international/article/2026/06/19/le-monde-s-point-by-point-breakdown-of-the-fragile-us-iran-framework-agreement_6754675_4.html,Subscribers only,"After more than 100 days of war, the United States and Iran signed a memorandum of understanding aimed at ending their conflict. The document will be followed by negotiations to address issues it does not resolve. Le Monde publishes the full text, along with context and analysis.",,https://img.lemde.fr/2026/06/19/0/0/3000/2000/400/266/75/0/eaf4062_upload-1-tmccmwsvlfao-frame-1390-copie-2.jpg,
Russia's shadow looms behind several sabotage and espionage attempts on French soil,https://www.lemonde.fr/en/france/article/2026/06/20/russia-s-shadow-looms-behind-several-sabotage-and-espionage-attempts-on-french-soil_6754683_7.html,Subscribers only,,,https://img.lemde.fr/2026/06/16/0/0/5446/3630/398/265/75/0/43c2c12_ftp-1-wij0ukwvyxae-2026-06-16t094544z-844620825-rc2xulagsp2o-rtrmadp-3-france-politics-ai.JPG,
Israel and Hezbollah agree to ceasefire after deadly exchanges between the two sides,https://www.lemonde.fr/en/international/article/2026/06/19/lebanon-says-47-killed-in-strikes-israel-reports-deaths-of-four-soldiers_6754676_4.html,,,,https://img.lemde.fr/2026/06/19/0/0/3240/2160/398/265/75/0/b3e8329_ftp-1-rnmyeo4k8pkf-2026-06-19t144517z-142180161-rc21xlat1296-rtrmadp-3-iran-crisis-israel-lebanon.JPG,
Andy Burnham hopes Makerfield by-election win paves his way to Downing Street,https://www.lemonde.fr/en/international/article/2026/06/19/andy-burnham-hopes-makerfield-by-election-win-paves-his-way-to-downing-street_6754678_4.html,Subscribers only,The mayor of Greater Manchester is increasingly emerging as the likely successor to Keir Starmer at the head of Labour – and the next government.,,https://img.lemde.fr/2026/06/19/0/0/5500/3666/398/265/75/0/6afe2d5_ftp-1-wjw72tureanm-2026-06-19t103303z-1919480954-rc2ywlajvuk0-rtrmadp-3-britain-politics-makerfield.JPG,
"After US signals another review of its military presence in Europe, allies grapple with Washington's ambiguities",https://www.lemonde.fr/en/international/article/2026/06/20/after-us-signals-another-review-of-its-military-presence-in-europe-allies-grapple-with-washington-s-ambiguities_6754682_4.html,Subscribers only,"On June 18, the US defense secretary announced a 'review' of the distribution of American NATO forces on the continent. The decision has raised concerns, even though it is being presented as a simple 'adjustment,' a senior US defense official told Le Monde.",,https://img.lemde.fr/2026/06/02/0/0/4719/3146/398/265/75/0/714dfe6_upload-1-b7dp9sc1egt0-filande-otan-olm-15.jpg,
USA down Australia 2-0 to reach World Cup knockout rounds,https://www.lemonde.fr/en/sports/article/2026/06/19/usa-down-australia-2-0-to-reach-world-cup-knockout-rounds_6754681_9.html,,The Americans have made a dream start to the tournament with Friday's victory following a 4-1 demolition of Paraguay in their opening game last week. Co-host Mexico has also sealed its place in the knockout rounds after beating South Korea 1-0 on Thursday.,,https://img.lemde.fr/2026/06/19/86/0/3283/2188/398/265/75/0/029651a_ftp-1-uwyayqyow2a7-2026-06-19t212209z-1337177866-up1em6j1ncv28-rtrmadp-3-soccer-worldcup-usa-aus.JPG,
"'They call us misfits, degenerates': Free parties fall under French government scrutiny",https://www.lemonde.fr/en/campus/article/2026/06/19/they-call-us-misfits-degenerates-free-parties-fall-under-french-government-scrutiny_6754677_11.html,Subscribers only,"Thousands of people gathered on June 6 in the south of France for a rave party, despite the events being banned locally until the end of the year. Participants defend them as among the last spaces of freedom outside of commercial and institutional frameworks.",Gabrielle Meulle,https://img.lemde.fr/2026/06/09/9/0/640/426/664/442/75/0/9652fbc_upload-1-etvu3fonmmyi-hm20260606054558.jpg,Feature
Andy Burnham hopes Makerfield by-election win paves his way to Downing Street,https://www.lemonde.fr/en/international/article/2026/06/19/andy-burnham-hopes-makerfield-by-election-win-paves-his-way-to-downing-street_6754678_4.html,Subscribers only,,,https://img.lemde.fr/2026/06/19/0/0/5500/3666/198/132/95/0/6afe2d5_ftp-1-wjw72tureanm-2026-06-19t103303z-1919480954-rc2ywlajvuk0-rtrmadp-3-britain-politics-makerfield.JPG,
Poland strips Zelensky of Warsaw's top award amidst escalating row over WWII memory,https://www.lemonde.fr/en/international/article/2026/06/19/poland-strips-zelensky-of-warsaw-s-top-award-amidst-escalating-row-over-wwii-memory_6754680_4.html,,,,https://img.lemde.fr/2026/06/19/0/0/3661/2441/198/132/95/0/775d2bb_ftp-1-q5yllwslcrys-6377dbc29f534386b7ac3ed7f025ab47-0-48cde7cb006140508c60d2dcfa5ff34b.jpg,
Palantir objects to France ending domestic security contract: 'You can't do this on Instagram. This is a very serious matter.',https://www.lemonde.fr/en/economy/article/2026/06/19/palantir-objects-to-france-ending-domestic-security-contract-you-can-t-do-this-on-instagram-this-is-a-very-serious-matter_6754679_19.html,Subscribers only,,,https://img.lemde.fr/2026/06/19/0/0/7602/5068/198/132/95/0/7df5a00_upload-1-g14yr6rrzpiu-000-93a64rq.jpg,
Vance's stark warning to Israeli leaders: 'Donald J. Trump is the only head of state in the entire world who is sympathetic to the nation of Israel',https://www.lemonde.fr/en/international/article/2026/06/19/vance-delivers-stark-warning-to-israel-donald-j-trump-is-the-only-head-of-state-in-the-entire-world-who-is-sympathetic-to-the-nation-of-israel_6754664_4.html,Subscribers only,,,https://img.lemde.fr/2026/06/18/4/0/6000/4000/198/132/95/0/07fa59a_ftp-1-txakicmf5kou-5362959-01-06.jpg,
Heatwave hits more than half of France's population,https://www.lemonde.fr/en/france/article/2026/06/19/heatwave-hits-more-than-half-of-france-s-population_6754671_7.html,,,,,
Mozart manuscript discovered at French National Library to be performed for the first time,https://www.lemonde.fr/en/culture/article/2026/06/19/mozart-manuscript-discovered-at-french-national-library-to-be-performed-for-the-first-time_6754674_30.html,Subscribers only,,,,
Paris issues last-minute ban on Iranian opposition rally,https://www.lemonde.fr/en/france/article/2026/06/19/paris-issues-last-minute-ban-on-iranian-opposition-rally_6754672_7.html,,,,,
'The French are reading less and the consequence is that many bookshops now face extinction',https://www.lemonde.fr/en/opinion/article/2026/06/19/the-french-are-reading-less-and-the-consequence-is-that-many-bookshops-now-face-extinction_6754665_23.html,Subscribers only,,,,
France detains man suspected of spying on drone factory for Russia,https://www.lemonde.fr/en/international/article/2026/06/19/france-detains-man-suspected-of-spying-on-drone-factory-for-russia_6754663_4.html,,,,,
Ukrainian defense manufacturers seek their footing as headliners at Eurosatory arms fair in Paris,https://www.lemonde.fr/en/international/article/2026/06/19/ukrainian-defense-manufacturers-seek-their-footing-as-headliners-at-eurosatory-arms-fair-in-paris_6754659_4.html,Subscribers only,,,,
Bruno Mars brings funk and romance to Paris,https://www.lemonde.fr/en/culture/article/2026/06/19/bruno-mars-brings-funk-and-romance-to-paris_6754662_30.html,Subscribers only,,,,
Ancient fault discovery means Paris region may face higher seismic risk,https://www.lemonde.fr/en/environment/article/2026/06/19/ancient-fault-discovery-means-paris-region-may-face-higher-seismic-risk_6754670_114.html,Subscribers only,,,,
"In Trump's polarized America, empathy faces unanimous opposition",https://www.lemonde.fr/en/opinion/article/2026/06/18/in-trump-s-polarized-america-empathy-faces-unanimous-opposition_6754642_23.html,Subscribers only,"Once valued in American public life, empathy now faces criticism from the far right, which sees it as a sign of weakness. The left, too, is questioning its relevance: In a world where brutality prevails, can we still afford to show understanding?",Marc-Olivier Bherer,https://img.lemde.fr/2026/06/12/247/0/1772/1181/664/442/75/0/868ced8_upload-1-p8em0b9frupn-idees-usa-empathie-bonhomme-2026.jpg,In Depth
Trump welcomed at Versailles after G7: 'Macron has turned the château into a diplomatic extension of the Elysée',https://www.lemonde.fr/en/international/article/2026/06/17/trump-welcomed-at-versailles-after-g7-macron-has-turned-the-chateau-into-a-diplomatic-extension-of-the-elysee_6754604_4.html,Subscribers only,"In an interview, historian Fabien Oppermann said that the dinner planned for Wednesday highlights the French president's desire 'to impress his counterpart,' in hopes of preserving the transatlantic relationship at a time when ties with the US are especially strained.",Thomas Wieder,https://img.lemde.fr/2026/06/16/333/0/5000/3333/664/442/75/0/8261c7b_upload-1-7rfzqceqxprh-kzihnioglu-evian-g7-15062026-3-01.JPG,Interview
"French security replaces Palantir with domestic firm ChapsVision, a complicated choice",https://www.lemonde.fr/en/france/article/2026/06/17/french-security-replaces-palantir-with-domestic-firm-chapsvision-a-complicated-choice_6754592_7.html,Subscribers only,"Used since the 2015 terrorist attacks, the controversial American company's data analysis software is set to be gradually replaced by that of a French provider. The long-awaited decision presents a significant technological challenge.",Olivier Pinaud,https://img.lemde.fr/2026/06/11/0/0/6000/4000/664/442/75/0/0acd44a_ftp-1-go54jge26dco-5288516-01-06.jpg,In Depth
Ukraine turns the tide of war in its favor,https://www.lemonde.fr/en/opinion/article/2026/06/19/ukraine-turns-the-tide-of-war-in-its-favor_6754666_23.html,,,,,Editorial
"'In Iran, none of the causes that sparked the relentless and admirable anti-regime uprisings has disappeared'",https://www.lemonde.fr/en/opinion/article/2026/06/19/in-iran-none-of-the-causes-that-sparked-the-relentless-and-admirable-anti-regime-uprisings-has-disappeared_6754655_23.html,Subscribe,,,https://img.lemde.fr/2025/02/13/0/0/0/0/100/100/60/0/012c520_sirius-fs-upload-1-siebgildln9p-1739442624103-capture-da-a-cran-2025-02-13-112806.png,Column
French government urged to reveal hidden assets of the rich,https://www.lemonde.fr/en/politics/article/2026/06/17/france-no-longer-knows-who-its-wealthiest-citizens-are-government-urged-to-reopen-black-box-on-the-assets-of-the-richest_6754601_5.html,Subscribe,,,,News
