title,link,premium,subhead,byline,image_url,article_type
"250 years of American independence: Thomas Jefferson and John Adams, 'the North and South poles of the American Revolution'",https://www.lemonde.fr/en/international/article/2026/06/25/250-years-of-american-independence-thomas-jefferson-and-john-adams-the-north-and-south-poles-of-the-american-revolution_6754877_4.html,Subscribers only,"'America 250' (4/13). Fifty years to the day after the adoption of the Declaration of Independence, two of its architects died: the enigmatic Thomas Jefferson and the impulsive John Adams. This coincidence only strengthened, among the population, the sense of an unprecedented destiny promised to their nation.",,https://img.lemde.fr/2026/06/19/482/0/1654/1102/400/266/75/0/d8c172d_upload-1-cozet23hg7u6-capture-d-e-cran-2026-06-19-a-11-38-02.jpg,
"'I almost faint every time I stand up': In cramped student housing, studying becomes impossible during the heatwave",https://www.lemonde.fr/en/campus/article/2026/06/26/i-almost-faint-every-time-i-stand-up-in-cramped-student-housing-studying-becomes-impossible-during-the-heatwave_6754888_11.html,Subscribers only,,,https://img.lemde.fr/2026/06/23/2155/0/4928/3285/398/265/75/0/6b1fda7_upload-1-swulowfqdbwc-kew2026012g0622-1014160.jpg,
"UK's King Charles breaks precedent, revealing £30 million paid in personal taxes since 2022",https://www.lemonde.fr/en/international/article/2026/06/26/uk-s-king-charles-breaks-precedent-revealing-30-million-paid-in-personal-taxes-since-2022_6754885_4.html,,,,https://img.lemde.fr/2026/06/25/184/0/3760/2506/398/265/75/0/731a648_ftp-1-fca573tpqrrt-5442420-01-06.jpg,
How cities in Africa are adapting to intense and deadly heat,https://www.lemonde.fr/en/le-monde-africa/article/2026/06/26/how-cities-in-africa-are-adapting-to-intense-and-deadly-heat_6754886_124.html,Subscribers only,"Reflective paints, green roofs, work breaks: Many African countries are seeking innovative ways to cope with increasingly extreme temperatures.",,https://img.lemde.fr/2026/06/25/0/315/3402/2268/398/265/75/0/23a3b98_upload-1-0rkqm4zrxpar-2026-02-12t084525z-1931742395-rc22hja1xf73-rtrmadp-3-climate-change-safrica-drought.JPG,
Iran intensifies internal crackdown as US and Israel wage war on regime,https://www.lemonde.fr/en/international/article/2026/06/26/iran-intensifies-internal-crackdown-as-us-and-israel-wage-war-on-regime_6754884_4.html,Subscribers only,"While diplomatic talks between Tehran and Washington focus on Iran's nuclear program and sanctions, NGOs are warning that executions and mass arrests continue.",,https://img.lemde.fr/2026/06/24/0/8/9357/6238/398/265/75/0/c640a5c_upload-1-phuswff66xmy-080-hl-ebroncard-3127141.jpg,
Sam Barlow: The art of fragmented storytelling from the creator of 'Her Story' and 'Immortality',https://www.lemonde.fr/en/pixels/article/2026/06/26/sam-barlow-the-art-of-fragmented-storytelling-from-the-creator-of-video-games-her-story-and-immortality_6754883_13.html,Subscribers only,"Since 'Her Story' (2015), the video game designer has subverted traditional narrative mechanics, immersing players in a profusion of video fragments and leaving them to piece the story back together.",,https://img.lemde.fr/2026/06/22/418/0/3402/2268/398/265/75/0/fdc6237_upload-1-i2mcs4wo7z70-sambarlow-07.JPG,
"French tolerance remains strong, but racism and antisemitism still run deep, report finds",https://www.lemonde.fr/en/france/article/2026/06/25/french-tolerance-remains-strong-but-racism-and-antisemitism-still-run-deep-report-finds_6754879_7.html,Subscribers only,"In its annual report released on Thursday, the National Consultative Commission on Human Rights expresses concern about the persistence of xenophobic prejudices in French society, particularly among the younger generation.",Louise Couvelaire,https://img.lemde.fr/2025/04/29/0/0/8256/5504/664/442/75/0/923943f_sirius-fs-upload-1-ovnwj9ob9xif-1745885482499-000-424y9dl.jpg,In Depth
Prosecutors drop rape charges against Harvey Weinstein after three trials ended without a verdict,https://www.lemonde.fr/en/culture/article/2026/06/26/prosecutors-drop-rape-charges-against-harvey-weinstein-after-three-trials-ended-without-a-verdict_6754890_30.html,,,,https://img.lemde.fr/2026/06/25/0/0/4999/3333/198/132/95/0/ccca425_ftp-1-sn8aziekbdxp-2026-06-25t165820z-1679017552-rc241mamie75-rtrmadp-3-people-harvey-weinstein.JPG,
US Supreme Court backs Trump on turning away asylum seekers at border,https://www.lemonde.fr/en/international/article/2026/06/26/us-supreme-court-backs-trump-on-turning-away-asylum-seekers-at-border_6754887_4.html,,,,https://img.lemde.fr/2026/06/25/0/92/5131/3421/198/132/95/0/62db3b2_ftp-1-lqqibv6j7wun-5439237-01-06.jpg,
Paris bans public drinking as heatwave overwhelms hospitals,https://www.lemonde.fr/en/france/article/2026/06/25/paris-bans-public-drinking-as-heatwave-overwhelms-hospitals_6754880_7.html,,,,https://img.lemde.fr/2026/06/23/0/0/7761/5174/198/132/95/0/e17994d_ftp-1-vx6skje0gpqm-5417062-01-06.jpg,
"Israel vows indefinite military occupation of Lebanon, Gaza and Syria",https://www.lemonde.fr/en/international/article/2026/06/25/israel-vows-indefinite-military-occupation-of-lebanon-gaza-and-syria_6754882_4.html,,,,https://img.lemde.fr/2026/06/22/1/0/5539/3692/198/132/95/0/de0692a_ftp-1-alqrzige4jmz-5405792-01-06.jpg,
"Pesticide use rises again in France, especially for PFAS family chemicals",https://www.lemonde.fr/en/environment/article/2026/06/25/pesticide-use-rises-again-in-france-especially-for-pfas-family-chemicals_6754881_114.html,Subscribers only,,,,
Trump uses the United States's 250th anniversary celebrations to celebrate himself,https://www.lemonde.fr/en/international/article/2026/06/25/trump-uses-the-united-states-s-250th-anniversary-celebrations-to-celebrate-himself_6754856_4.html,Subscribers only,,,,
Court rules oil and gas giant TotalEnergies must account for its clients' CO₂ emissions,https://www.lemonde.fr/en/environment/article/2026/06/25/court-rules-oil-and-gas-giant-totalenergies-must-account-for-its-clients-co-emissions_6754878_114.html,Subscribers only,,,,
Venezuela reels after deadliest double earthquake in 126 years,https://www.lemonde.fr/en/environment/article/2026/06/25/venezuela-reels-after-deadliest-double-earthquake-in-126-years_6754858_114.html,Subscribers only,,,,
"Paris Mayor Grégoire on the climate crisis: 'To adapt together, we need to change our way of life'",https://www.lemonde.fr/en/politics/article/2026/06/25/paris-mayor-gregoire-on-the-climate-crisis-to-adapt-together-we-need-to-change-our-way-of-life_6754853_5.html,Subscribers only,,,,
Three-year-old found dead in car in Paris region during France heatwave,https://www.lemonde.fr/en/france/article/2026/06/25/three-year-old-found-dead-in-car-in-paris-region-during-france-heatwave_6754860_7.html,,,,,
Death of Lyhanna: 'Comprehensive law' on Assemblée Nationale's agenda marks victory for feminist and child advocacy groups,https://www.lemonde.fr/en/politics/article/2026/06/25/death-of-lyhanna-comprehensive-law-on-assemblee-nationale-s-agenda-marks-victory-for-feminist-and-child-advocacy-groups_6754868_5.html,Subscribers only,,,,
"'Impossible to sleep': A night in sweltering France, in search of a cool spot",https://www.lemonde.fr/en/politics/article/2026/06/25/impossible-to-sleep-a-night-in-sweltering-france-in-search-of-a-cool-spot_6754874_5.html,Subscribers only,,,,
France's public pools need urgent renovation: 'What would we do without them? We wouldn't make it',https://www.lemonde.fr/en/france/article/2026/06/23/france-s-public-pools-need-urgent-renovation-what-would-we-do-without-them-we-wouldn-t-make-it_6754772_7.html,Subscribers only,"Aging, energy-intensive and expensive for rural towns to maintain, many aquatic centers in the countryside have been shutting down. Yet these facilities provide equal access for people to cool off and learn to swim. An MP recently sounded the alarm about the worrying situation facing these essential local public services.",Camille Bordenet,https://img.lemde.fr/2026/06/18/1/0/4000/2666/664/442/75/0/454f930_upload-1-rdhh1ttuqsbu-mahka-eslami-piscine-municipale-de-cha-teauneuf-sur-sarthe092.jpg,Feature
"Living under Paris's zinc roofs in 40°C heat: 'One day, the people living there will look for those responsible'",https://www.lemonde.fr/en/economy/article/2026/06/23/living-under-paris-s-zinc-roofs-in-40-c-heat-one-day-the-people-living-there-will-look-for-those-responsible_6754804_19.html,Subscribers only,"As France faces extreme heat, many of these top-story spaces have become uninhabitable. Some residents have formed groups to call on their landlords, neighbors and local authorities to address their living conditions.",Emeline Cazi,https://img.lemde.fr/2026/06/23/1643/0/4928/3285/664/442/75/0/f1b1bd0_upload-1-bplzz5kb8c4y-kew2026012g0622-1013930.jpg,Feature
"Serving a husband, God and America: Young female conservatives gather at San Antonio's Turning Point summit",https://www.lemonde.fr/en/m-le-mag/article/2026/06/23/serving-a-husband-god-and-america-young-female-conservatives-gather-at-san-antonio-s-turning-point-summit_6754806_117.html,Subscribers only,"In early June, around 3,000 women attended the Women's Leadership Summit in San Antonio, Texas. This annual event brings together a variety of conservative figures and influencers, relying on the extensive network of Turning Point USA, founded by right-wing activist Charlie Kirk, who was murdered in 2025. After convincing a majority of young men to vote for Trump in 2024, the organization now targets female voters from Gen Z.",Eve Minault,https://img.lemde.fr/2026/06/15/0/4/1492/995/664/442/75/0/d0d1357_ftp-1-tkngv55k1n2q-432511-3476302.jpg,Feature
Trumpism gains ground in Latin America,https://www.lemonde.fr/en/opinion/article/2026/06/25/trumpism-gains-ground-in-latin-america_6754859_23.html,,,,,Editorial
'10th anniversary of Brexit referendum marks event long thought impossible in the UK: The rise of the far right',https://www.lemonde.fr/en/opinion/article/2026/06/23/10th-anniversary-of-brexit-referendum-marks-event-long-thought-impossible-in-the-uk-the-rise-of-the-far-right_6754771_23.html,Subscribe,,,https://img.lemde.fr/2025/02/13/0/0/0/0/100/100/60/0/e49d71b_sirius-fs-upload-1-hfccvvna5map-1739442970267-capture-da-a-cran-2025-02-13-113500.png,Column
'The special tribunal on the aggression against Ukraine could be a major step toward protecting the legal architecture built after World War II',https://www.lemonde.fr/en/international/article/2026/06/25/the-special-tribunal-on-ukraine-s-aggression-could-be-a-major-step-toward-protecting-the-legal-architecture-built-after-world-war-ii_6754844_4.html,Subscribe,,,,Interview
