title,link,premium,subhead,byline,image_url,article_type
A new radical left is shaking up the Democratic party,https://www.lemonde.fr/en/international/article/2026/07/02/a-new-radical-left-is-shaking-up-the-democratic-party_6755072_4.html,Subscribers only,"A new generation of candidates, critical of elites, social injustice and US support for Israel, is making its mark in the Democratic primaries ahead of November's midterm elections.",,https://img.lemde.fr/2026/07/01/1/0/5930/3953/400/266/75/0/6467d4f_ftp-1-jw7eisul6zwm-25a543ba0cb5442bae31aa5924b51a2f-0-e14380ec9e95429f99370bef49c2be00.jpg,
French court overturns conviction of man accused of murdering four family members in 1994,https://www.lemonde.fr/en/france/article/2026/07/02/french-court-overturns-conviction-of-man-accused-of-murdering-four-family-members-in-1994_6755083_7.html,,,,https://img.lemde.fr/2026/07/02/1/0/8192/5461/398/265/75/0/6c48534_ftp-1-xu8irxbjw8bi-5507765-01-06.jpg,
Iran and US negotiations stall over future of Strait of Hormuz,https://www.lemonde.fr/en/international/article/2026/07/02/iran-and-us-negotiations-stall-over-future-of-strait-of-hormuz_6755074_4.html,Subscribers only,,,https://img.lemde.fr/2026/07/01/0/0/6031/4020/398/265/75/0/3e4fc4e_ftp-1-yhtla6m8xbqx-2026-07-01t093726z-1153167832-rc254maeybtp-rtrmadp-3-iran-crisis-shipping-fees.JPG,
"Nearly 35,000 people became millionaires in France in 2025, UBS study finds",https://www.lemonde.fr/en/economy/article/2026/07/02/nearly-35-000-people-became-millionaires-in-france-in-2025-ubs-study-finds_6755064_19.html,Subscribers only,"The number of millionaires worldwide has reached record highs, according to the report. Real estate and finance remain the most effective ways to build wealth.",,https://img.lemde.fr/2025/02/26/0/272/3862/2575/398/265/75/0/a1a2d42_ftp-import-images-1-bhpyweiknj1b-2025-02-26t174717z-69666489-rc298x9k111k-rtrmadp-3-swiss-banks.JPG,
A typology of France's presidential candidates,https://www.lemonde.fr/en/opinion/article/2026/07/02/a-typology-of-france-s-presidential-candidates_6755080_23.html,Subscribers only,"From the desperate to those surfing the anti-establishment wave, not all candidates have the same motivations, observes Le Monde columnist Françoise Fressoz.",,https://img.lemde.fr/2024/03/05/0/0/7771/5181/398/265/75/0/078db7d_1709661483907-000-34jl6lz.jpg,
Paris Opera house renovations extended by three years,https://www.lemonde.fr/en/france/article/2026/07/02/paris-opera-house-renovations-extended-by-three-years_6755079_7.html,,"The iconic Palais Garnier will be closed from 2027-2032, three years longer than initially planned due to lead contamination.",,https://img.lemde.fr/2025/01/15/101/0/6215/4143/398/265/75/0/f71935a_sirius-fs-upload-1-7lmjwbqx7qag-1736956967193-15375-e-bauer-opera-national-de-paris-facade-palais-garnier-e-bauer-onp.JPG,
French taxman targets hot-air balloon sector,https://www.lemonde.fr/en/politics/article/2026/07/02/french-taxman-targets-hot-air-balloons_6755087_5.html,Subscribers only,"France's Finance Ministry accused hot-air balloon operators of applying a reduced VAT rate, reserved for air transport, instead of the higher rate for leisure activities. Business owners argue that the authorities changed the rules without warning.",Denis Cosnard,https://img.lemde.fr/2026/06/30/0/0/8256/5504/664/442/75/0/ac06910_upload-1-yrpdzbamrplb-000-684r2up.jpg,In Depth
How can we prepare together for the next heatwave?,https://www.lemonde.fr/en/environment/article/2026/07/02/how-can-we-prepare-together-for-the-next-heatwave_6755070_114.html,Subscribers only,,,https://img.lemde.fr/2026/06/28/0/25/2466/1644/198/132/95/0/c7e5c6f_ftp-1-6hja6wr0jtw0-5470599-01-06.jpg,
Earlier and more intense heatwaves drive expansion of swimming in Paris,https://www.lemonde.fr/en/economy/article/2026/07/02/earlier-and-more-intense-heatwaves-drive-expansion-of-swimming-in-paris_6755078_19.html,Subscribers only,,,https://img.lemde.fr/2026/06/18/260/0/6236/4157/198/132/95/0/546e429_upload-1-phr3jopvigu6-kew2026011g0617-1013713.jpg,
Wildfire in southern France forces evacuations,https://www.lemonde.fr/en/france/article/2026/07/02/wildfire-in-southern-france-forces-evacuations_6755063_7.html,,,,https://img.lemde.fr/2026/07/01/0/0/9504/6336/198/132/95/0/e1afe00_ftp-1-2ggie8eteccv-5504038-01-06.jpg,
'Biggest ever' Russian attack on Kyiv kills over 20,https://www.lemonde.fr/en/international/article/2026/07/02/russian-strikes-on-kyiv-kill-at-least-nine-overnight_6755068_4.html,,,,https://img.lemde.fr/2026/07/02/0/0/5455/3636/198/132/95/0/81f003d_ftp-1-f2ecoc2njytn-2026-07-02t054935z-350411235-rc2e5mave63c-rtrmadp-3-ukraine-crisis-attack-kyiv.JPG,
Ukraine's General Valery Zaluzhny emerges as a key figure in national politics,https://www.lemonde.fr/en/international/article/2026/07/02/ukraine-s-general-valery-zaluzhny-emerges-as-a-key-figure-in-national-politics_6755061_4.html,Subscribers only,,,,
Macron's heirs contend with perceptions of his track record,https://www.lemonde.fr/en/politics/article/2026/07/02/macron-s-heirs-contend-with-perceptions-of-his-track-record_6755065_5.html,Subscribers only,,,,
Choice of presidential election dates raises questions,https://www.lemonde.fr/en/politics/article/2026/07/02/choice-of-french-presidential-election-dates-raises-questions_6755069_5.html,Subscribers only,,,,
Heat and acoustics: The challenges of outdoor opera at Aix-en-Provence,https://www.lemonde.fr/en/culture/article/2026/07/02/the-aix-en-provence-opera-festival-faces-the-challenge-of-performing-outdoors-amid-heat-and-sound-issues_6755067_30.html,Subscribers only,,,,
"ChapsVision, the little-known software company set to replace US giant Palantir for France's domestic security agency",https://www.lemonde.fr/en/economy/article/2026/07/02/chapsvision-the-little-known-software-company-set-to-replace-us-giant-palantir-for-france-s-domestic-security-agency_6755076_19.html,Subscribers only,,,,
"Starmer apologizes for forced adoption of nearly 200,000 babies born to unmarried mothers",https://www.lemonde.fr/en/international/article/2026/07/02/starmer-apologizes-for-forced-adoption-of-nearly-200-000-babies-born-to-unmarried-mothers_6755077_4.html,,,,,
Bad Bunny brings Puerto Rican pride to Marseille,https://www.lemonde.fr/en/culture/article/2026/07/02/bad-bunny-brings-puerto-rican-pride-to-marseille_6755073_30.html,Subscribers only,,,,
French justice system investigates alleged criminal Israeli airstrikes in Lebanon,https://www.lemonde.fr/en/international/article/2026/07/02/french-justice-system-investigates-alleged-criminal-israeli-airstrikes-in-lebanon_6755085_4.html,Subscribers only,,,,
"Lebanon's Shiites, torn over Hezbollah, question the meaning of their sacrifices",https://www.lemonde.fr/en/international/article/2026/07/01/lebanon-s-shiites-torn-over-hezbollah-question-the-meaning-of-their-sacrifices_6755054_4.html,Subscribers only,"Days after Lebanon and Israel signed a framework agreement, supporters and opponents of the militia-party are still measuring the consequences of the devastating war.",Hélène Sallon,https://img.lemde.fr/2026/06/23/999/0/3002/2001/664/442/75/0/a2340a5_upload-1-jhuw4hl1epmy-raf-liban-chiite-018.JPG,Long Read
'We should not accept that heatwaves cause thousands of deaths. That is not normal',https://www.lemonde.fr/en/environment/article/2026/06/30/we-should-not-accept-that-heatwaves-cause-thousands-of-deaths-that-is-not-normal_6754994_114.html,Subscribers only,"In an interview with Le Monde, Julien Dossier, founder of the environmental consulting firm Quattrolibri, offers an initial political assessment of how France responded to the most intense heatwave ever recorded in the country.",Audrey Garric,https://img.lemde.fr/2026/06/26/0/0/8256/5504/664/442/75/0/687527f_upload-1-vexbewxx61o8-aideadomicile-11.jpg,Interview
"250 years of American independence: In 1976, a bicentennial celebrated with patriotism despite divisions",https://www.lemonde.fr/en/international/article/2026/07/01/250-years-of-american-independence-in-1976-a-bicentennial-celebrated-with-patriotism-despite-divisions_6755053_4.html,Subscribers only,"'America 250' (10/13). In 1976, the United States turned a page on one of the most turbulent chapters in its history. After the Vietnam War and the resignation of Richard Nixon, the bicentennial offered Americans a moment of relief. Minority rights, social justice – new debates continued to stir society, notably led by the economist Jeremy Rifkin and the 'red, white and blue' left.",Corine Lesnes,https://img.lemde.fr/2026/06/29/3/0/4313/2875/664/442/75/0/978ce47_upload-1-rgf7q5ee9akn-gettyimages-515407760.jpg,Series
Fighting relentlessly against the death penalty,https://www.lemonde.fr/en/opinion/article/2026/07/02/fighting-relentlessly-against-the-death-penalty_6755075_23.html,,,,,Editorial
"The right to choose one's death, the final freedom",https://www.lemonde.fr/en/opinion/article/2026/07/01/the-right-to-choose-one-s-death-the-final-freedom_6755048_23.html,,,,,Editorial
"'The heatwave shows, beyond any doubt, that without strong mitigation measures, adaptation will be impossible'",https://www.lemonde.fr/en/environment/article/2026/06/30/the-heatwave-shows-beyond-any-doubt-that-without-strong-mitigation-measures-adaptation-will-be-impossible_6754995_114.html,Subscribe,,,,Column
