title,link,premium,subhead,byline,image_url,article_type
Venezuela earthquakes: 'The rescue workers didn't try anything. They say it's too dangerous. But we keep going',https://www.lemonde.fr/en/international/article/2026/06/30/venezuela-earthquakes-the-rescue-workers-didn-t-try-anything-they-say-it-s-too-dangerous-but-we-keep-going_6755002_4.html,Subscribers only,"For the past five days, in La Guaira, the area hit hardest by the two earthquakes, families of victims buried beneath collapsed buildings have worked without pause to pull relatives from the rubble.",,https://img.lemde.fr/2026/06/28/0/0/8256/5504/400/266/75/0/4d5ba88_ftp-1-zt3ixplihhqp-5474666-01-06.jpg,
"'I resisted xenophobic pressure in the past. But now, we have to leave': In South Africa, a violent campaign against foreigners",https://www.lemonde.fr/en/le-monde-africa/article/2026/06/30/i-resisted-xenophobic-pressure-in-the-past-but-now-we-have-to-leave-in-south-africa-a-violent-campaign-against-foreigners_6755003_124.html,Subscribers only,,,https://img.lemde.fr/2026/06/29/0/0/4200/2800/398/265/75/0/d7f8792_ftp-1-w0uywwzqzp2o-5480269-01-06.jpg,
France just experienced its most intense heatwave ever. Ask your questions to Le Monde's climate expert,https://www.lemonde.fr/en/environment/live/2026/06/30/france-just-experienced-its-most-intense-heatwave-ever-ask-your-questions-to-le-monde-s-climate-expert_6755005_114.html,Article in live,,,https://img.lemde.fr/2026/05/27/1/0/6669/4446/398/265/75/0/06ec252_ftp-1-46cy3qfmuvkd-2026-05-27t173045z-1925620926-rc2phlanut4i-rtrmadp-3-europe-weather-france-heat.JPG,
British PM-in-waiting Burnham presents decentralization plans,https://www.lemonde.fr/en/international/article/2026/06/30/british-pm-in-waiting-burnham-presents-decentralization-plans_6755004_4.html,Subscribers only,"The likely successor to Keir Starmer highlighted devolution and reindustrialization as his key priorities. But with tight budget restraints, early doubts are emerging within Labour about his room for maneuver.",,https://img.lemde.fr/2026/06/29/0/0/7762/5174/398/265/75/0/d7f6871_ftp-1-gryvh9bveum9-b169b77ada0a42429c18004e8259e07f-0-6b3bb43a79474e9a89a28cccbba69c9b.jpg,
France passes watered-down legislation to curb fast fashion,https://www.lemonde.fr/en/economy/article/2026/06/30/france-passes-watered-down-legislation-to-curb-fast-fashion_6754996_19.html,Subscribers only,"The law aimed at 'reducing the environmental impact of the textile industry' passed its final reading in the Sénat on June 29. Its content underwent numerous revisions over the past two years, particularly to accommodate domestic players in France, while excluding online giants Shein and Temu from those concessions.",,https://img.lemde.fr/2026/06/29/0/0/5921/3947/398/265/75/0/6fcd898_upload-1-c4f2vg0osdzb-2025-11-05t123042z-15183565-rc2cqhakjt37-rtrmadp-3-shein-france.JPG,
Six Bad Bunny songs to know before his concerts in France,https://www.lemonde.fr/en/culture/article/2026/06/30/six-bad-bunny-songs-to-know-before-his-concerts-in-france_6754999_30.html,Subscribers only,The Puerto Rican superstar is set to perform at the Stade-Vélodrome in Marseille on July 1 and at the Plenitude Arena in Nanterre on July 4 and 5.,,https://img.lemde.fr/2026/06/20/0/1/3669/2446/398/265/75/0/ee231ad_ftp-1-iwp7jj3tnzge-7de9a655844e465eb7a09f598e646207-0-5d9b9c71ece64aba9c77c7b62e4892bb.jpg,
"In the DRC's Ebola epicenter, a 'cascade of deaths' and fear of contamination",https://www.lemonde.fr/en/le-monde-africa/article/2026/06/30/in-the-drc-s-ebola-hotspot-a-cascade-of-deaths-and-fear-of-contamination_6754997_124.html,Subscribers only,"Le Monde traveled to Mongbwalu, a town in the eastern Democratic Republic of the Congo, where the Ebola virus outbreak began. As the death toll continues to rise, local health facilities and NGOs have become overwhelmed, hampered by a shortage of resources.",Morgane Le Cam and  Philémon Barbier,https://img.lemde.fr/2026/06/26/0/0/4000/2666/664/442/75/0/82a3f75_upload-1-p4i3ita0zl3f-27-pb-lemonde-ebola-mongbwalu-ituri-rdc.jpg,Feature
Monaco police launch manhunt for suspect after parcel bomb blast injures three,https://www.lemonde.fr/en/international/article/2026/06/30/monaco-parcel-bomb-blast-injures-3-including-ukrainian-tycoon_6755001_4.html,,,,https://img.lemde.fr/2026/06/29/0/0/5785/3857/198/132/95/0/6c58e3a_ftp-1-dflidjphfu88-5486374-01-06.jpg,
France appears to consider freeing consular agent in exchange for journalist held in Algeria,https://www.lemonde.fr/en/international/article/2026/06/30/france-appears-to-consider-freeing-consular-agent-in-exchange-for-journalist-held-in-algeria_6755006_4.html,Subscribers only,,,https://img.lemde.fr/2026/06/29/65/0/2048/1365/198/132/95/0/1f308f9_upload-1-sokzed6g4wl2-484488046-122110008638788656-6187544341113888577-n.jpg,
'We should not accept that heatwaves cause thousands of deaths. That is not normal',https://www.lemonde.fr/en/environment/article/2026/06/30/we-should-not-accept-that-heatwaves-cause-thousands-of-deaths-that-is-not-normal_6754994_114.html,Subscribers only,,,https://img.lemde.fr/2026/06/26/0/0/8256/5504/198/132/95/0/687527f_upload-1-vexbewxx61o8-aideadomicile-11.jpg,
"Crypto world rocked as new regulations push hundreds of platforms out of European market, including Binance",https://www.lemonde.fr/en/economy/article/2026/06/30/crypto-world-rocked-as-new-regulations-push-hundreds-of-platforms-out-of-the-european-market-including-giant-binance_6754998_19.html,Subscribers only,,,https://img.lemde.fr/2026/06/29/0/0/4272/2848/198/132/95/0/ab7bc2f_upload-1-fekkimjnpmw4-2025-08-29t053842z-803086518-rc2sgga4qf6d-rtrmadp-3-asia-crypto.JPG,
US Supreme Court gives Trump the power to fire top officials across the administration – except at the Fed,https://www.lemonde.fr/en/economy/article/2026/06/30/us-supreme-court-gives-trump-the-power-to-fire-top-officials-across-the-administration-except-at-the-fed_6754992_19.html,Subscribers only,,,,
Keiko Fujimori narrowly wins Peru's presidential runoff,https://www.lemonde.fr/en/international/article/2026/06/29/keiko-fujimori-narrowly-wins-peru-s-presidential-runoff_6754990_4.html,,,,,
French government criticized over climate record and sluggish heatwave response,https://www.lemonde.fr/en/politics/article/2026/06/29/french-government-criticized-over-climate-record-and-sluggish-heatwave-response_6754968_5.html,Subscribers only,,,,
"France releases first estimate of heatwave mortality, as at-home deaths rise",https://www.lemonde.fr/en/health/article/2026/06/29/france-releases-first-estimate-of-heatwave-mortality-as-at-home-deaths-rise_6754966_14.html,Subscribers only,,,,
European lawmakers call on FIFA to investigate 'Peace Prize' awarded to Trump by Infantino,https://www.lemonde.fr/en/sports/article/2026/06/29/european-lawmakers-call-on-fifa-to-investigate-peace-prize-awarded-to-trump-by-infantino_6754985_9.html,Subscribers only,,,,
"Israeli forces kill Palestinian teen in West Bank, says Palestinian health ministry",https://www.lemonde.fr/en/international/article/2026/06/29/israeli-forces-kill-palestinian-teen-in-west-bank-says-palestinian-health-ministry_6754989_4.html,,,,,
"The killing of West Bank children by Israel's army, a product of Palestinians' dehumanization",https://www.lemonde.fr/en/international/article/2026/06/29/the-killing-of-west-bank-children-by-israel-s-army-a-product-of-palestinians-dehumanization_6754982_4.html,Subscribers only,The Israeli human rights organization B'Tselem documented the deaths of 54 minors killed by the Israeli army in the occupied West Bank in January 2025 and the impunity enjoyed by its soldiers.,Laurence Geai and  Luc Bronner,https://img.lemde.fr/2026/06/26/0/0/5760/3840/664/442/75/0/2285eae_upload-1-vtgdjnwuu3el-lgeai-enterrement-sam-18.jpg,In Depth
"Identitarian group Némésis funds itself through PayPal, which turns a blind eye",https://www.lemonde.fr/en/les-decodeurs/article/2026/06/29/identitarian-group-nemesis-funds-itself-through-paypal-which-turns-a-blind-eye_6754963_8.html,Subscribers only,"The giant American payment platform has allowed the far-right group's online shop to prosper, contradicting its own policies, according to an investigation by the US nonprofit organization The Fuller Project, published by Le Monde.",Polina Bachlakova,https://img.lemde.fr/2026/02/21/0/0/8256/5504/664/442/75/0/f3eae2d_ftp-1-2unfcndk7f3x-5254643-01-06.jpg,Investigation
"'Their mouths, eyes, hands, were taped and they were thrown into the hole': Russian soldiers confront Putin with reality of front lines",https://www.lemonde.fr/en/international/article/2026/06/28/their-mouths-eyes-hands-were-taped-and-they-were-thrown-into-the-hole-russian-soldiers-confront-putin-with-reality-of-front-lines_6754954_5.html,Subscribers only,"A Russian exile media outlet has analyzed nearly 7,000 letters from Russian soldiers and their families to the Kremlin thanks to a security flaw.",Benjamin Quénelle,https://img.lemde.fr/2026/06/25/673/0/4000/2666/664/442/75/0/68f1786_upload-1-on67o7s23kgh-008.JPG,News
"'The heatwave shows, beyond any doubt, that without strong mitigation measures, adaptation will be impossible'",https://www.lemonde.fr/en/environment/article/2026/06/30/the-heatwave-shows-beyond-any-doubt-that-without-strong-mitigation-measures-adaptation-will-be-impossible_6754995_114.html,Subscribe,,,,Column
'Is the Gulf Persian or Arabian? Or both?',https://www.lemonde.fr/en/international/article/2026/06/28/is-the-gulf-persian-or-arabian-or-both_6754946_4.html,Subscribe,,,https://img.lemde.fr/2023/07/31/0/0/0/0/100/100/60/0/d45bb07_1690791602941-eac5c14-1647333440018-jean-pierre-filiu-2019.jpg,Column
France heatwave: Why adaptation and mitigation must go hand in hand,https://www.lemonde.fr/en/opinion/article/2026/06/27/france-heatwave-why-adaptation-and-mitigation-must-go-hand-in-hand_6754930_23.html,,,,,Editorial
