title,link,premium,subhead,byline,image_url,article_type
Yemeni children at the heart of Houthi war machine,https://www.lemonde.fr/en/international/article/2026/07/24/yemeni-children-at-the-heart-of-houthi-war-machine_6755783_4.html,Subscribers only,"Since the coup at the end of 2014, Yemeni rebels have forcibly recruited thousands of minors each year, sending them to the front lines to fight against the government and Saudi Arabia.",,https://img.lemde.fr/2026/07/16/0/0/5305/3536/400/266/75/0/760f998_upload-1-ykavwqxdf9re-eawr7358.JPG,
"After two diplomats were violently detained in Tehran, France expresses concern for its nationals in Iran",https://www.lemonde.fr/en/international/article/2026/07/24/after-two-diplomats-were-violently-detained-in-tehran-france-expresses-concern-for-its-nationals-in-iran_6755780_4.html,Subscribers only,,,https://img.lemde.fr/2026/07/22/0/0/5748/3832/398/265/75/0/c2efd88_ftp-1-c8cd5o33nbee-2026-07-22t104253z-435315505-rc2yimap6h4i-rtrmadp-3-france-politics.JPG,
US unveils new tariffs on 60 partners as Trump rebuilds trade agenda,https://www.lemonde.fr/en/international/article/2026/07/24/us-unveils-new-tariffs-on-60-partners-as-trump-rebuilds-trade-agenda_6755776_4.html,,,,https://img.lemde.fr/2026/07/21/0/0/3840/2560/398/265/75/0/3b442b7_ftp-1-ix9hmvytupu2-5677193-01-06.jpg,
"Bruno Cotte, magistrate: 'Contrary to what Marco Rubio claims, the International Criminal Court is neither right-wing nor left-wing'",https://www.lemonde.fr/en/opinion/article/2026/07/24/bruno-cotte-magistrate-contrary-to-what-marco-rubio-claims-the-international-criminal-court-is-neither-right-wing-nor-left-wing_6755777_23.html,Subscribers only,"The US Secretary of State's campaign to dismantle the ICC marks an assault on international law that should prompt much stronger reactions from its founders, especially the Europeans, argues the former ICC chamber president for Le Monde.",,https://img.lemde.fr/2026/02/25/0/0/1500/1000/398/265/75/0/7c79c9c_upload-1-rqkmynu9noh1-frame-1295.jpg,
"Bernard Arnault, generous patron of the arts and lover of tax breaks",https://www.lemonde.fr/en/summer-reads/article/2026/07/23/bernard-arnault-generous-patron-of-the-arts-and-lover-of-tax-breaks_6755771_183.html,Subscribers only,"'Bernard Arnault's Empire' (5/6). France's richest man is also one of Europe's leading art collectors. Through the Fondation Louis Vuitton, he combines his passion for the arts with highly lucrative tax arrangements.",,https://img.lemde.fr/2026/07/16/1594/0/3444/2296/398/265/75/0/f00bfc4_upload-1-x8wa9jdfo2ik-rv-45859-15.jpg,
Chanel's XXL cruise ship in May 2018,https://www.lemonde.fr/en/summer-reads/article/2026/07/23/chanel-s-xxl-cruise-ship-in-may-2018_6755775_183.html,Subscribers only,"'Behind the scene' (2/6). Fashion houses often use runway shows as opportunities for particularly spectacular set designs. In May 2018, Karl Lagerfeld docked a life-size cruise ship under the glass dome of the Grand Palais in Paris for Chanel's cruise collection show.",,https://img.lemde.fr/2026/07/07/107/0/1600/1066/398/265/75/0/8501521_upload-1-b0prgu0iz94a-774-decor-show-012-preview.jpg,
My life as a Russian exile in Paris: 'France is an improved version of the USSR',https://www.lemonde.fr/en/summer-reads/article/2026/07/24/my-life-as-a-russian-exile-in-paris-france-is-an-improved-version-of-the-ussr_6755784_183.html,Subscribers only,"'A Russian in Paris' (2/6). After arriving in France in 2022, journalist Elizaveta Osetinskaya settled in Paris' 16th arrondissement. She especially praises the French school system, which her daughter Bella now benefits from.",Elizaveta Osetinskaya,https://img.lemde.fr/2026/07/16/550/0/1850/1233/664/442/75/0/2f4e73f_upload-1-ty42grvy6jrq-episode-2-e-cole.jpg,News
Bastia Museum exhibition traces migratory history between Corsica and Maghreb,https://www.lemonde.fr/en/culture/article/2026/07/24/in-bastia-the-corsica-maghreb-exhibition-explores-the-migratory-connections-between-the-island-and-north-africa_6755781_30.html,Subscribers only,,,https://img.lemde.fr/2026/07/22/1122/0/4280/2853/198/132/95/0/493d8b7_upload-1-6cfmc3ojxxxl-img-5756-4.jpg,
Salman Rushdie testifies at knife attacker's US trial on terrorism charges,https://www.lemonde.fr/en/international/article/2026/07/24/salman-rushdie-testifies-at-knife-attacker-s-us-trial-on-terrorism-charges_6755782_4.html,,,,https://img.lemde.fr/2026/07/22/0/111/5209/3473/198/132/95/0/15267ba_ftp-1-g73eq7iip62y-fd212e06ac9f4daeb487aa00603e89b6-1-d791f44fb1bb4760964e36b38bf90380.jpg,
US vows to punish Iran after Houthis strike tankers,https://www.lemonde.fr/en/international/article/2026/07/24/us-vows-to-punish-iran-after-houthis-strike-tankers_6755779_4.html,,,,https://img.lemde.fr/2026/07/21/0/0/6657/4438/198/132/95/0/cd507c7_ftp-1-xjyt3mbxi0gj-5673109-01-06.jpg,
"Overrun with tourists, Annecy attempts to steer visitors away from its overcrowded lake and old town",https://www.lemonde.fr/en/economy/article/2026/07/24/overrun-with-tourists-annecy-attempts-to-steer-them-away-from-its-overcrowded-lake-and-old-town_6755778_19.html,Subscribers only,,,https://img.lemde.fr/2026/07/21/0/0/3640/2426/198/132/95/0/5c3462f_upload-1-fr9oh863zd6f-maxnewsspecialtwo669017.jpg,
"France evacuates 20,000 as fire rages in southwestern pine forest",https://www.lemonde.fr/en/environment/article/2026/07/23/france-evacuates-20-000-as-fire-rages-in-southwestern-pine-forest_6755764_114.html,,,,,
"European Commission fines Google €890 million, risking Trump's ire",https://www.lemonde.fr/en/economy/article/2026/07/23/european-commission-fines-google-890-million-risking-trump-s-ire_6755767_19.html,Subscribers only,,,,
"In the West Bank, a Palestinian hamlet faces relentless harassment by settlers",https://www.lemonde.fr/en/international/article/2026/07/23/in-the-west-bank-a-palestinian-hamlet-faces-relentless-harassment-by-settlers_6755770_4.html,Subscribers only,,,,
Fields medal awarded to four young mathematicians,https://www.lemonde.fr/en/international/article/2026/07/23/fields-medal-awarded-to-four-young-mathematicians_6755774_4.html,,,,,
"Salah Abdeslam, punished for protesting his prison conditions, challenges the administration",https://www.lemonde.fr/en/france/article/2026/07/23/salah-abdeslam-punished-for-protesting-his-prison-conditions-challenges-the-administration_6755762_7.html,Subscribers only,,,,
The mysterious horse-shaped geoglyph England has been maintaining for thousands of years,https://www.lemonde.fr/en/m-le-mag/article/2026/07/23/the-mysterious-horse-shaped-geoglyph-england-has-been-maintaining-for-thousands-of-years_6755772_117.html,Subscribers only,,,,
Carapaz claims Tour de France 18th stage as Pogacar loses key teammate,https://www.lemonde.fr/en/sports/article/2026/07/23/carapaz-claims-tour-de-france-18th-stage-as-pogacar-loses-key-team-mate_6755773_9.html,,,,,
Chanel's XXL cruise ship in May 2018,https://www.lemonde.fr/en/summer-reads/article/2026/07/23/chanel-s-xxl-cruise-ship-in-may-2018_6755775_183.html,Subscribers only,,,,
How Macron narrowly averted his environment minister's resignation,https://www.lemonde.fr/en/politics/article/2026/07/23/how-macron-narrowly-averted-his-environment-minister-s-resignation_6755750_5.html,Subscribers only,"Monique Barbut, who said she intended to quit the government on Tuesday, July 21, after an agricultural law she contested was adopted, ended up staying on in her role on Wednesday. The twist added a colorful note to the political crisis.",Nathalie Segaunes,https://img.lemde.fr/2026/07/22/0/4/2952/1968/664/442/75/0/241173d_ftp-1-okw4377qplrw-2026-07-22t100059z-107944366-rc2yimadcql6-rtrmadp-3-france-politics.JPG,In Depth
"Despite living 'like a walking dead man,' South Africa's Thabiso Zulu continues crusade against ANC corruption",https://www.lemonde.fr/en/le-monde-africa/article/2026/07/22/south-africa-despite-living-like-a-walking-dead-man-thabiso-zulu-continues-crusade-against-anc-corruption_6755723_124.html,Subscribers only,"For nearly a decade, the 44-year-old man has lived like a hunted animal. He sleeps in a different place almost every night and only shares meeting locations at the last moment.",Benjamin Barthe,https://img.lemde.fr/2026/07/16/0/0/6720/4480/664/442/75/0/b315a5a_upload-1-qkp0uo4gn2lf-le-monde-pietermaritzburg-photographs-4762.jpg,News
My life as a Russian exile in Paris: 'You can't fight French bureaucracy',https://www.lemonde.fr/en/summer-reads/article/2026/07/23/my-life-as-a-russian-exile-in-paris-you-can-t-fight-french-bureaucracy_6755746_183.html,Subscribers only,"'A Russian in Paris' (1/6). Journalist Elizaveta Osetinskaya, who came to France in 2022 because of her opposition to the war in Ukraine, describes the difficulties she has faced with the prefecture while barely speaking the language.",Elizaveta Osetinskaya,https://img.lemde.fr/2026/07/22/296/0/1850/1233/664/442/75/0/eb751a9_upload-1-ct68mxdtxy5i-russieok.jpg,Series
France's agriculture law puts government in a bind,https://www.lemonde.fr/en/opinion/article/2026/07/22/france-s-agriculture-law-puts-government-in-a-bind_6755726_23.html,,,,,Editorial
'Stopping AI because it carries risks? That would be like banning cars because they cause accidents',https://www.lemonde.fr/en/opinion/article/2026/07/22/stopping-ai-because-it-carries-risks-that-would-be-like-banning-cars-because-they-cause-accidents_6755705_23.html,Subscribe,,,,Op-Ed
The profile of France's new defender of rights raises concern,https://www.lemonde.fr/en/opinion/article/2026/07/23/the-profile-of-france-s-new-defender-of-rights-raises-concern_6755763_23.html,,,,,Editorial
