title,link,premium,subhead,byline,image_url,article_type
"For Macron, the legalization of aid in dying meant a long personal journey",https://www.lemonde.fr/en/politics/article/2026/07/15/for-macron-the-legalization-of-aid-in-dying-took-a-long-personal-journey_6755491_5.html,Subscribers only,"After doubting the need for new legislation, fearing he might upset religious leaders and concerned about dividing French society, the president eventually resolved to support the legislation, under pressure from MPs and public opinion.",,https://img.lemde.fr/2026/07/14/0/3/7993/5329/400/266/75/0/5c6e296_upload-1-w4ukjjjr41n1-jmug260713083.jpg,
"René Obermann, chairman of Airbus: 'We must put an end to industrial nationalism in defense'",https://www.lemonde.fr/en/economy/article/2026/07/15/rene-obermann-chairman-of-airbus-we-must-put-an-end-to-industrial-nationalism-in-defense_6755496_19.html,Subscribers only,,,https://img.lemde.fr/2026/07/14/1112/0/5212/3474/398/265/75/0/7180d37_upload-1-bxjblp8gwwxf-rea10590784.jpg,
Iran and US slide back into dead end of war,https://www.lemonde.fr/en/opinion/article/2026/07/15/iran-and-us-slide-back-into-dead-end-of-war_6755492_23.html,,,,https://img.lemde.fr/2026/07/13/0/0/6000/4000/398/265/75/0/a2aa747_ftp-1-34pszvbrzvib-f7749da3f14147d5bb435bf757b9f679-1-f8d7c41a8156425f9811b21ebfdd60c0.jpg,Editorial
"France facing 'very worrying' drought, says environment minister",https://www.lemonde.fr/en/france/article/2026/07/15/france-facing-very-worrying-drought-says-environment-minister_6755499_7.html,,"Environment Minister Monique Barbut said the drought was 'exceptionally' early France, which is sweltering under its third heatwave of the summer.",,https://img.lemde.fr/2026/07/11/0/0/12288/8192/398/265/75/0/95603dc_ftp-1-hy1ezxw85cy5-5593471-01-06.jpg,
US targets ICC in new offensive,https://www.lemonde.fr/en/international/article/2026/07/15/the-international-criminal-court-targeted-by-a-new-us-offensive_6755477_4.html,Subscribers only,"US Secretary of State Marco Rubio reopened a diplomatic campaign on Monday aimed at dismantling the ICC by combining sanctions, putting pressure on member states and seeking allies among major powers hostile to the institution.",,https://img.lemde.fr/2026/07/08/0/4/3432/2288/398/265/75/0/33b086e_ftp-1-4cfcvjkheyto-2026-07-08t164210z-570910450-rc2s9may8n33-rtrmadp-3-nato-summit-trump.JPG,
Spain picks apart Mbappé's powerless France in World Cup semi-final,https://www.lemonde.fr/en/sports/article/2026/07/15/spain-picks-apart-mbappe-s-powerless-france-in-world-cup-semi-final_6755488_9.html,Subscribers only,French captain Kylian Mbappé and his teammates fell to a Spanish side that outclassed them in every aspect of the game.,,https://img.lemde.fr/2026/07/14/0/1/3441/2294/398/265/75/0/cfe3761_ftp-1-viml0vwynbsa-5622447-01-06.jpg,
"Judge of 2016 Nice terror attack trial reflects on 'abominable' case, 10 years after",https://www.lemonde.fr/en/france/article/2026/07/14/the-judge-of-the-2016-nice-terror-attack-trial-reflects-on-abominable-case-10-years-after_6755470_7.html,Subscribers only,"Laurent Raviot presided over the Paris special criminal court that held the trial of the attack in Nice that killed 86 people on July 14, 2016. On the 10th anniversary of the attack, he granted Le Monde his first interview, speaking with unusual candor.",Soren Seelow,https://img.lemde.fr/2026/07/10/67/0/1600/1066/664/442/75/0/d477737_upload-1-enjzi1nglxbd-pre-sident-de-la-cour-d-assises-spe-ciale-de-paris-laurent-raviot.jpg,Interview
Wildfires that ravaged historic Fontainebleau forest outside Paris 'contained',https://www.lemonde.fr/en/france/article/2026/07/14/wildfires-continue-to-ravage-fontainebleau-forest-as-france-marks-bastille-day_6755458_7.html,,,,https://img.lemde.fr/2026/07/14/0/3/5493/3662/198/132/95/0/641bbe6_ftp-1-blvc4mdkhacj-2026-07-14t133700z-2087983077-rc2ndma40qr8-rtrmadp-3-europe-weather-france-wildfire.JPG,
"In Fontainebleau, southern France firefighters share expertise with Paris-region colleagues",https://www.lemonde.fr/en/environment/article/2026/07/14/in-fontainebleau-southern-france-firefighters-share-expertise-with-paris-region-colleagues_6755472_114.html,Subscribers only,,,https://img.lemde.fr/2026/07/14/0/0/6192/4128/198/132/95/0/2480cab_upload-1-xzkzshw2ry5w-incendie-en-foret-de-fontainebleau-49.jpg,
"From Paris to Nice, Macron marks his final Bastille Day with a series of commemorations",https://www.lemonde.fr/en/politics/article/2026/07/15/from-paris-to-nice-emmanuel-macron-marks-bastille-day-with-a-series-of-commemorations_6755481_5.html,Subscribers only,,,https://img.lemde.fr/2026/07/15/934/0/7000/4666/198/132/95/0/ddafdd2_upload-1-bgykwsfgmjev-kzihnioglu-pol-14-juillet-14072026-65.jpg,
"Ukraine expands attacks in Sea of Azov, a crucial maritime corridor for Russia",https://www.lemonde.fr/en/international/article/2026/07/15/ukraine-expands-attacks-to-the-sea-of-azov-a-crucial-maritime-corridor-for-russia_6755475_4.html,Subscribers only,,,https://img.lemde.fr/2026/07/09/0/319/2919/1946/198/132/95/0/2eb72d0_ftp-1-qlxkfyonzdh5-2026-07-09t104259z-1765130317-rc2aamah55f9-rtrmadp-3-ukraine-crisis-tankers.JPG,
Why France's national weather service struggles to accurately predict heatwaves,https://www.lemonde.fr/en/environment/article/2026/07/15/why-france-s-national-weather-service-struggles-to-give-accurate-heatwave-predictions_6755478_114.html,Subscribers only,,,,
EU speeds up accession talks with four candidate countries,https://www.lemonde.fr/en/international/article/2026/07/15/eu-speeds-up-accession-talks-with-four-candidate-countries_6755494_4.html,Subscribers only,,,,
"EU extends right to stay for Ukrainians, except for men of military age",https://www.lemonde.fr/en/international/article/2026/07/15/european-union-extends-right-to-stay-for-ukrainians-except-for-men-of-military-age_6755495_4.html,,,,,
Spanish ex-PM Rajoy refuses to back down from racist remark on French football team,https://www.lemonde.fr/en/international/article/2026/07/15/spanish-ex-pm-rajoy-refuses-to-back-down-from-racist-france-football-team-remark_6755493_4.html,,,,,
ICE suspends traffic-stop arrests after two fatal shootings,https://www.lemonde.fr/en/international/article/2026/07/15/ice-suspends-traffic-stop-arrests-after-two-fatal-shootings_6755482_4.html,,,,,
Macron presents UK's Starmer with France's highest award,https://www.lemonde.fr/en/international/article/2026/07/14/macron-presents-uk-s-starmer-with-france-s-highest-award_6755474_4.html,,,,,
"China's foreign trade surges, driven by AI and electric vehicles",https://www.lemonde.fr/en/economy/article/2026/07/15/china-s-foreign-trade-surges-driven-by-ai-and-electric-vehicles_6755476_19.html,Subscribers only,,,,
Prominent Morocco journalist released from custody pending probe,https://www.lemonde.fr/en/international/article/2026/07/15/prominent-morocco-journalist-released-from-custody-pending-probe_6755500_4.html,,,,,
Visualize the full extent of wildfires across Europe in recent weeks,https://www.lemonde.fr/en/les-decodeurs/article/2026/07/14/visualize-the-full-extent-of-wildfires-across-europe-in-recent-weeks_6755451_8.html,Subscribers only,The burned areas across the European continent have already far surpassed levels seen in recent years and are now approaching the maximum recorded in 2025.,Pierre Breteau,https://img.lemde.fr/2026/07/10/0/0/3840/2560/664/442/75/0/f3c2a33_upload-1-pzmr8dmczv5t-media-d-appel-light.png,In Graphs
'We were meant to take as many jewels as we could': The confessions of two Louvre burglars,https://www.lemonde.fr/en/france/article/2026/07/12/we-were-meant-to-take-as-many-jewels-as-we-could-the-confessions-of-two-louvre-burglars_6755398_7.html,Subscribers only,"After months of silence, two men suspected of stealing the royal jewels described their involvement in detail during new interrogations in June. According to their statements, they were hired to carry out the heist for '€15,000 to €25,000.'",Jérémie Pham-Lê and  Lucie Soullier,https://img.lemde.fr/2026/07/11/0/93/7722/5148/664/442/75/0/2a52031_upload-1-h1iiu0yszurt-000-79ar7mw.jpg,In Depth
"How the 2016 Nice terrorist attack unfolded, minute-by-minute",https://www.lemonde.fr/en/france/video/2026/07/13/how-the-2016-nice-terrorist-attack-unfolded-minute-by-minute_6755441_7.html,Subscribers only,"On July 14, 2016, a terrorist drove a truck into crowds gathered on the famed Promenade des Anglais in the southern French city, killing 86 people. Ten years later, Le Monde looks back at how the tragedy unfolded.",,https://img.lemde.fr/2026/07/10/0/150/1620/1080/664/442/75/0/6098888_upload-1-xyixzbdp93j4-6098888-upload-1-hbrfj3utpffd-nice-recit-sirius.png,Investigation
Iran and US slide back into dead end of war,https://www.lemonde.fr/en/opinion/article/2026/07/15/iran-and-us-slide-back-into-dead-end-of-war_6755492_23.html,,,,,Editorial
'It would have been enough to learn the terrible lessons from Gaza to anticipate the current impasse over Iran',https://www.lemonde.fr/en/international/article/2026/07/12/it-would-have-been-enough-to-learn-the-terrible-lessons-from-gaza-to-anticipate-the-current-impasse-over-iran_6755416_4.html,Subscribe,,,https://img.lemde.fr/2023/07/31/0/0/0/0/100/100/60/0/d45bb07_1690791602941-eac5c14-1647333440018-jean-pierre-filiu-2019.jpg,Column
French MPs' vote to establish presumption of legitimate defense for police sets dangerous precedent,https://www.lemonde.fr/en/opinion/article/2026/07/12/french-mps-vote-to-establish-presumption-of-legitimate-defense-for-police-sets-dangerous-precedent_6755413_23.html,,,,,Editorial
