title,link,premium,subhead,byline,image_url,article_type
"Martine Barrat, a photographer without fear or limits",https://www.lemonde.fr/en/m-le-mag/article/2026/07/12/martine-barrat-a-photographer-without-fear-or-limits_6755391_117.html,Subscribers only,"At 93, the artist has lost none of her vitality or curiosity. She lives at the legendary Hotel Chelsea in New York, where she remains one of the last year-round artist residents. Today, her work is the subject of a retrospective at the Rencontres d'Arles photography festival.",,https://img.lemde.fr/2026/06/30/382/0/1200/800/400/266/75/0/509e5ca_ftp-1-hbcbynanjmsm-434309-3480713.jpg,
US launches new strikes on Iran after container ship hit in Hormuz,https://www.lemonde.fr/en/international/article/2026/07/12/iran-announces-closure-of-the-strait-of-hormuz-until-further-notice_6755387_4.html,,,,https://img.lemde.fr/2026/07/10/0/429/4642/3095/398/265/75/0/afc85c9_ftp-1-yt2bpau69j8e-2026-07-10t130543z-1345548046-rc25amatsfkg-rtrmadp-3-iran-crisis-shipping-un.JPG,
'No region is safe from climate change: Brittany will not be a climate refuge',https://www.lemonde.fr/en/opinion/article/2026/07/12/no-region-is-safe-from-climate-change-brittany-will-not-be-a-climate-refuge_6755386_23.html,Subscribers only,,,https://img.lemde.fr/2026/02/25/0/0/1500/1000/398/265/75/0/e51850b_upload-1-1m3mwho1pn4a-frame-1323.jpg,
US Senator and Trump ally Lindsey Graham has died aged 71,https://www.lemonde.fr/en/international/article/2026/07/12/us-senator-and-trump-lindsey-graham-has-died-aged-71_6755393_4.html,,The Republican senator was in Kyiv meeting with Ukrainian President Zelensky on Saturday.,,https://img.lemde.fr/2026/07/12/0/0/4645/3096/398/265/75/0/0156029_ftp-1-rbfncc4ztgh2-2026-07-12t070804z-154245171-rc22bma9eeit-rtrmadp-3-people-lindsey-graham.JPG,
Why heatwaves disrupt our sleep – and how we can protect it,https://www.lemonde.fr/en/science/article/2026/07/11/why-heatwaves-disrupt-our-sleep-and-how-we-can-protect-it_6755384_10.html,Subscribers only,"High temperatures shorten nights by affecting sleep quality, posing a threat to public health. To help combat this, one expert advises keeping up morning outings to avoid further disruptions to our body clocks.",,https://img.lemde.fr/2026/07/10/0/0/4999/3333/398/265/75/0/3a63d05_upload-1-6pto5d6do2nb-000-b8e33ke.jpg,
How live screenings of Paris Fashion Week are making fashion more accessible,https://www.lemonde.fr/en/m-le-mag/article/2026/07/12/how-live-screenings-of-paris-fashion-week-are-making-fashion-more-accessible_6755385_117.html,Subscribers only,"Organized by influencer Lyas, free live screenings of fashion shows on big screens toured France during Paris Men's Fashion Week. Several hundred people gathered in Marseille for the opening night.",,https://img.lemde.fr/2026/06/24/1/0/2500/1666/398/265/75/0/08dabae_upload-1-ij8mhd8s9ze6-z63-5244-copie.jpg,
"Before Emile Zola, this forgotten writer was the first to defend Alfred Dreyfus",https://www.lemonde.fr/en/m-le-mag/article/2026/07/12/before-emile-zola-this-forgotten-writer-was-the-first-to-defend-alfred-dreyfus_6755389_117.html,Subscribers only,"The journalist Bernard Lazare fought relentlessly to defend Captain Dreyfus and denounce the antisemitism that drove his conviction. On Sunday, France will mark its first national day commemorating the rehabilitation of the Jewish officer.",Marius Joly,https://img.lemde.fr/2026/06/30/332/0/1079/719/664/442/75/0/cb699d2_ftp-1-jsxtp7adhpqa-434253-3488274.jpg,Feature
Argentina secures their place in World Cup semi-final with 3-1 victory over Switzerland,https://www.lemonde.fr/en/sports/article/2026/07/12/argentina-secures-their-place-in-world-cup-semi-final-with-3-1-victory-over-switzerland_6755392_9.html,,,,https://img.lemde.fr/2026/07/12/0/21/3064/2043/198/132/95/0/51e72cb_ftp-1-wfns39opbwun-2026-07-12t040618z-2104767818-up1em7c0behym-rtrmadp-3-soccer-worldcup-arg-swi.JPG,
Police arrest 28-year-old suspect over killing of UK politician,https://www.lemonde.fr/en/international/article/2026/07/12/police-arrest-28-year-old-suspect-over-killing-of-uk-politician_6755390_4.html,,,,https://img.lemde.fr/2026/07/10/0/0/5319/3546/198/132/95/0/ce28f7e_ftp-1-29gj7aia8bzw-187d5f7264b04f4ead675ceae5642133-0-b14e47b7fe7c4d54ae6ed3b5fdf9e894.jpg,
Kyiv spends sleepless nights underground as Russia intensifies attacks,https://www.lemonde.fr/en/international/article/2026/07/11/war-in-ukraine-kyiv-spends-sleepless-nights-underground-as-russia-intensifies-attacks_6755371_4.html,Subscribers only,,,https://img.lemde.fr/2026/07/10/197/0/2953/1968/198/132/95/0/2a89c88_upload-1-y4dq6fquyf20-2026-07-10-heg-ukraine-0091.JPG,
"England defeats Norway 2-1 in extra time, sliding into World Cup semis",https://www.lemonde.fr/en/sports/article/2026/07/12/england-defeats-norway-2-1-in-extra-time-sliding-into-world-cup-semis_6755388_9.html,,,,https://img.lemde.fr/2026/07/12/0/100/5037/3358/198/132/95/0/5650c55_ftp-1-gn9gp19yalkv-5599754-01-06.jpg,
"'You're expected to perform, but no one wants to know how you do it': Cocaine, the toxic fuel of young professionals",https://www.lemonde.fr/en/campus/article/2026/07/11/you-re-expected-to-perform-but-no-one-wants-to-know-how-you-do-it-cocaine-the-toxic-fuel-of-young-professionals_6755382_11.html,Subscribers only,,,,
Noskova defeats fellow Czech Muchova to win first Wimbledon,https://www.lemonde.fr/en/sports/article/2026/07/11/noskova-defeats-fellow-czech-muchova-to-win-first-wimbledon_6755383_9.html,,,,,
"French stayed put during June heatwave, cutting back movements",https://www.lemonde.fr/en/economy/article/2026/07/11/french-stayed-put-during-june-heatwave-cutting-back-movements_6755374_19.html,Subscribers only,,,,
Houston killing of Mexican man by ICE reignites debate over US immigration agency,https://www.lemonde.fr/en/international/article/2026/07/11/houston-killing-of-mexican-man-by-ice-reignites-debate-over-us-immigration-agency_6755370_4.html,Subscribers only,,,,
"France's Socialists opt for a presidential primary, but who will run?",https://www.lemonde.fr/en/politics/article/2026/07/11/france-s-socialists-opt-for-a-presidential-primary-but-who-will-run_6755375_5.html,Subscribers only,,,,
Sunday's Tour de France stage to be shortened due to 'intense heatwave',https://www.lemonde.fr/en/sports/article/2026/07/11/sunday-s-tour-de-france-stage-to-be-shortened-due-to-intense-heatwave_6755378_9.html,,,,,
Tour de France: Merlier wins second consecutive stage,https://www.lemonde.fr/en/sports/article/2026/07/11/tour-de-france-merlier-wins-second-consecutive-stage_6755377_9.html,,,,,
'The latest chapter in Le Pen's legal saga illustrates the intractable challenge of judging politicians',https://www.lemonde.fr/en/opinion/article/2026/07/11/the-latest-chapter-in-le-pen-s-legal-saga-illustrates-the-intractable-challenge-of-judging-politicians_6755376_23.html,Subscribers only,,,,
"Tiago Rodrigues, director of the Avignon Festival: 'Thanks to Europe, thanks to democracy, how lucky I have been!'",https://www.lemonde.fr/en/culture/article/2026/07/11/tiago-rodrigues-director-of-the-avignon-festival-thanks-to-europe-thanks-to-democracy-how-lucky-i-have-been_6755381_30.html,Subscribers only,"'I wouldn't be where I am today if...' In this series, Le Monde interviews a personality about a decisive moment in their life. The director of the Avignon Festival discusses the indelible mark that the Portuguese dictatorship left on his family history.",Sandrine Blanchard,https://img.lemde.fr/2026/06/26/1622/0/4160/2773/664/442/75/0/752bf49_upload-1-agfrwgbp92ek-tiago-rodrigues-terencebk-1.jpg,Interview
Silicon Valley's next generation feels the AI blues,https://www.lemonde.fr/en/m-le-mag/article/2026/07/11/when-it-comes-to-ai-nothing-s-right-silicon-valley-is-torn_6755365_117.html,Subscribers only,"In California, the rise of artificial intelligence no longer generates the unanimous enthusiasm it once did. Anxiety is mounting, especially among students and engineers, as jobs have been cut and democratic risks have grown more threatening.",Arnaud Leparmentier,https://img.lemde.fr/2026/06/23/0/19/1431/954/664/442/75/0/02c5195_ftp-1-isxrj01bdeym-433389-3475879.jpg,Long Read
Is air conditioning good or bad? Join this (fake) group chat for (real) analysis,https://www.lemonde.fr/en/les-decodeurs/article/2026/07/10/is-air-conditioning-good-or-bad-join-this-fake-group-chat-for-real-analysis_6755351_8.html,Subscribers only,"Each time a new heatwave hits, the question of air conditioning and its environmental impacts crops up in the public debate. Here are the key points to help you understand what is at stake.",Lara Pino Lerro and  Romain Imbach,https://img.lemde.fr/2026/06/30/0/0/5735/3823/664/442/75/0/4710dd2_ftp-1-0pwutsr4roga-9b14fba68ce0495bb521ecfcbe7db159-2-5b9feaf45d55480e85a0beac5c279ede.jpg,Explainer
'Imperial obsession and reckless escalation: Vladimir Putin has never appeared so trapped by his fantasies',https://www.lemonde.fr/en/opinion/article/2026/07/09/imperial-obsession-and-reckless-escalation-vladimir-putin-has-never-appeared-so-trapped-by-his-fantasies_6755314_23.html,Subscribe,,,https://img.lemde.fr/2025/02/13/0/0/0/0/100/100/60/0/012c520_sirius-fs-upload-1-siebgildln9p-1739442624103-capture-da-a-cran-2025-02-13-112806.png,Column
Marine Le Pen's shifting principles,https://www.lemonde.fr/en/opinion/article/2026/07/08/marine-le-pen-s-shifting-principles_6755274_23.html,,,,,Editorial
"'A World Cup is not a reflection of international relations, or if it is, it is a particularly distorted one'",https://www.lemonde.fr/en/opinion/article/2026/07/09/a-world-cup-is-not-a-reflection-of-international-relations-or-if-it-is-it-is-a-particularly-distorted-one_6755293_23.html,Subscribe,,,https://img.lemde.fr/2022/03/18/0/0/0/0/100/100/60/0/bfe4dc9_1647595527633-f2df5fa-237.jpeg,Column
