title,link,premium,subhead,byline,image_url,article_type
French PM Lecornu warns of 'fairly severe' wildfires arriving unusually early,https://www.lemonde.fr/en/environment/article/2026/07/03/french-pm-lecornu-warns-of-fairly-severe-wildfires-arriving-unusually-early_6755097_114.html,Subscribers only,"According to the prime minister, the wildfire season is running at least two weeks ahead of its usual schedule. With vegetation already extremely dry, he voiced concerns about the 'endurance' of firefighting resources.",,https://img.lemde.fr/2026/07/02/0/0/5200/3466/400/266/75/0/35879b5_upload-1-kslqmxgr5y7o-sipa-01279310-000016.jpg,
Heat dome roasts eastern US ahead of Fourth of July celebrations,https://www.lemonde.fr/en/international/article/2026/07/02/heat-dome-roasts-eastern-us-ahead-of-fourth-of-july-celebrations_6755095_4.html,,,,https://img.lemde.fr/2026/07/02/0/0/3000/2000/398/265/75/0/c8b5fa7_ftp-1-nz4g6rciacp8-5513623-01-06.jpg,
Spain power into World Cup last 16 with 3-0 win over Austria,https://www.lemonde.fr/en/sports/article/2026/07/02/spain-power-into-world-cup-last-16-with-3-0-win-over-austria_6755096_9.html,,,,https://img.lemde.fr/2026/07/02/0/203/4830/3220/398/265/75/0/815cf65_ftp-1-n9blkfp28smg-2026-07-02t212830z-684448606-up1em721nnggb-rtrmadp-3-soccer-worldcup-esp-aut.JPG,
Germany seeks to introduce a dose of Nordic-style 'flexicurity' into its labor law,https://www.lemonde.fr/en/economy/article/2026/07/03/germany-seeks-to-introduce-a-dose-of-nordic-style-flexicurity-into-its-labor-law_6755101_19.html,Subscribers only,"Through a series of reform plans, Berlin has committed to easing dismissal rules alongside measures to support job transitions, aiming to reduce the cost of failure for young companies.",,https://img.lemde.fr/2026/07/02/0/0/5500/3666/398/265/75/0/b8cd82a_ftp-1-vlleo6zlkhkd-2026-07-02t075649z-149743626-rc2j5maa24b8-rtrmadp-3-germany-politics-coalition.JPG,
"250 years of American independence: 'Enslaved and freed Black people were not merely witnesses to the Atlantic Revolutions, they were active participants'",https://www.lemonde.fr/en/opinion/article/2026/07/03/250-years-of-american-independence-enslaved-and-freed-black-people-were-not-merely-witnesses-to-the-atlantic-revolutions-they-were-active-participants_6755100_23.html,Subscribers only,"Elisabeth Landi, a history professor, argues in this op-ed for Le Monde that commemorations marking the birth of the United States should fully acknowledge the memory of Black fighters who shed their blood for a revolution that did not challenge the institution of slavery.",,https://img.lemde.fr/2026/03/05/0/0/1500/1000/398/265/75/0/d09a6fb_upload-1-ufawt3i05por-frame-1461.jpg,
Christopher Nolan's 'The Odyssey' sparks a Homeric debate in Greece,https://www.lemonde.fr/en/international/article/2026/07/03/christopher-nolan-s-the-odyssey-sparks-a-homeric-debate-in-greece_6755098_4.html,Subscribers only,"The casting of a Black actress as Helen of Troy has ignited fierce controversy in Greece. Some lament what they see as Hollywood's appropriation of Greek mythology, while others emphasize the universal nature of these ancient stories.",,https://img.lemde.fr/2026/07/01/0/0/3343/2229/398/265/75/0/8cd2959_upload-1-nqfl4mqwwcfw-000-36z29q9.jpg,
Anthropic President Daniela Amodei: 'We must embrace both the positive side and the dark side of AI',https://www.lemonde.fr/en/economy/article/2026/07/02/anthropic-president-daniela-amodei-we-must-embrace-both-the-positive-side-and-the-dark-side-of-ai_6755092_19.html,Subscribers only,"The president of the American artificial intelligence start-up, valued at $965 billion and known for its warnings about the risks of this technology, shares her perspective with Le Monde on the major issues facing the sector.",Alexandre Piquard,https://img.lemde.fr/2026/07/02/38/0/4000/2666/664/442/75/0/3ba0c51_upload-1-ewrer8zfyiti-daniela-amodei-par-raphae-l-neal-hd-03.jpg,Interview
"'In Sweden, Google ordered to pay one of the highest damages ever awarded in Europe in a private antitrust case'",https://www.lemonde.fr/en/economy/article/2026/07/03/in-sweden-google-ordered-to-pay-one-of-the-highest-damages-ever-awarded-in-europe-in-a-private-antitrust-case_6755099_19.html,Subscribers only,,,https://img.lemde.fr/2026/07/02/0/0/4990/3327/198/132/95/0/6cc685e_upload-1-kk1fztibtufc-2025-09-10t174955z-1421269712-rc24pgaeb677-rtrmadp-3-klarna-ipo-ai.JPG,
Thousands evacuated in southern France as wildfires rage,https://www.lemonde.fr/en/environment/article/2026/07/02/three-thousand-people-evacuated-in-southern-france-as-wildfires-rage_6755093_114.html,,,,https://img.lemde.fr/2026/07/02/0/0/9504/6336/198/132/95/0/d82aff7_ftp-1-tlnitdi0spfp-5513278-01-06.jpg,
DR Congo Ebola outbreak tops 400 deaths as virus reaches major city,https://www.lemonde.fr/en/international/article/2026/07/02/dr-congo-ebola-outbreak-tops-400-deaths-as-virus-reaches-major-city_6755094_4.html,,,,https://img.lemde.fr/2026/06/26/0/0/8256/5504/198/132/95/0/d603612_ftp-1-p26h3xe3jlba-c86c3126190e465db9855490b87a2e88-0-cdaa25d7173b4cb9aec46c25fe03576f.jpg,
"Trump, revisionism and the citizens fighting for the truth",https://www.lemonde.fr/en/international/article/2026/07/02/250-years-of-american-independence-trump-revisionism-and-the-citizens-fighting-for-the-truth_6755089_4.html,Subscribers only,,,https://img.lemde.fr/2026/06/30/0/157/1818/1212/198/132/95/0/11752be_upload-1-k0hfffs35nky-capture-d-e-cran-2026-06-30-a-16-40-01.png,
France's independent cinema chain MK2 bets on crowdfunding – and not corporate money – for its renovation,https://www.lemonde.fr/en/economy/article/2026/07/02/france-s-independent-cinema-chain-mk2-bets-on-crowdfunding-and-not-corporate-money-for-its-renovation_6755091_19.html,Subscribers only,,,,
French justice system investigates alleged criminal Israeli airstrikes in Lebanon,https://www.lemonde.fr/en/international/article/2026/07/02/french-justice-system-investigates-alleged-criminal-israeli-airstrikes-in-lebanon_6755085_4.html,Subscribers only,,,,
Paris Opera house renovations extended by three years,https://www.lemonde.fr/en/france/article/2026/07/02/paris-opera-house-renovations-extended-by-three-years_6755079_7.html,,,,,
Earlier and more intense heatwaves drive expansion of swimming in Paris,https://www.lemonde.fr/en/economy/article/2026/07/02/earlier-and-more-intense-heatwaves-drive-expansion-of-swimming-in-paris_6755078_19.html,Subscribers only,,,,
Explosive device kills at least nine people in Damascus café,https://www.lemonde.fr/en/international/article/2026/07/02/explosive-device-kills-at-least-4-people-in-damascus-cafe_6755088_4.html,,,,,
Bad Bunny brings Puerto Rican pride to Marseille,https://www.lemonde.fr/en/culture/article/2026/07/02/bad-bunny-brings-puerto-rican-pride-to-marseille_6755073_30.html,Subscribers only,,,,
Iran and US negotiations stall over future of Strait of Hormuz,https://www.lemonde.fr/en/international/article/2026/07/02/iran-and-us-negotiations-stall-over-future-of-strait-of-hormuz_6755074_4.html,Subscribers only,,,,
French court overturns conviction of man accused of murdering four family members in 1994,https://www.lemonde.fr/en/france/article/2026/07/02/french-court-overturns-conviction-of-man-accused-of-murdering-four-family-members-in-1994_6755083_7.html,,,,,
A new radical left is shaking up the Democratic party,https://www.lemonde.fr/en/international/article/2026/07/02/a-new-radical-left-is-shaking-up-the-democratic-party_6755072_4.html,Subscribers only,"A new generation of candidates, critical of elites, social injustice and US support for Israel, is making its mark in the Democratic primaries ahead of November's midterm elections.",Piotr Smolar,https://img.lemde.fr/2026/07/01/1/0/5930/3953/664/442/75/0/6467d4f_ftp-1-jw7eisul6zwm-25a543ba0cb5442bae31aa5924b51a2f-0-e14380ec9e95429f99370bef49c2be00.jpg,In Depth
"Lebanon's Shiites, torn over Hezbollah, question the meaning of their sacrifices",https://www.lemonde.fr/en/international/article/2026/07/01/lebanon-s-shiites-torn-over-hezbollah-question-the-meaning-of-their-sacrifices_6755054_4.html,Subscribers only,"Days after Lebanon and Israel signed a framework agreement, supporters and opponents of the militia-party are still measuring the consequences of the devastating war.",Hélène Sallon,https://img.lemde.fr/2026/06/23/999/0/3002/2001/664/442/75/0/a2340a5_upload-1-jhuw4hl1epmy-raf-liban-chiite-018.JPG,Long Read
"In the DRC's Ebola epicenter, a 'cascade of deaths' and fear of contamination",https://www.lemonde.fr/en/le-monde-africa/article/2026/06/30/in-the-drc-s-ebola-hotspot-a-cascade-of-deaths-and-fear-of-contamination_6754997_124.html,Subscribers only,"Le Monde traveled to Mongbwalu, a town in the eastern Democratic Republic of the Congo, where the Ebola virus outbreak began. As the death toll continues to rise, local health facilities and NGOs have become overwhelmed, hampered by a shortage of resources.",Morgane Le Cam and  Philémon Barbier,https://img.lemde.fr/2026/06/26/0/0/4000/2666/664/442/75/0/82a3f75_upload-1-p4i3ita0zl3f-27-pb-lemonde-ebola-mongbwalu-ituri-rdc.jpg,Feature
Fighting relentlessly against the death penalty,https://www.lemonde.fr/en/opinion/article/2026/07/02/fighting-relentlessly-against-the-death-penalty_6755075_23.html,,,,,Editorial
A typology of France's presidential candidates,https://www.lemonde.fr/en/opinion/article/2026/07/02/a-typology-of-france-s-presidential-candidates_6755080_23.html,Subscribe,,,https://img.lemde.fr/2023/07/06/0/0/0/0/100/100/60/0/bee4e6c_1688634540522-73f3cca-40.jpg,Column
'Is the Gulf Persian or Arabian? Or both?',https://www.lemonde.fr/en/international/article/2026/06/28/is-the-gulf-persian-or-arabian-or-both_6754946_4.html,Subscribe,,,https://img.lemde.fr/2023/07/31/0/0/0/0/100/100/60/0/d45bb07_1690791602941-eac5c14-1647333440018-jean-pierre-filiu-2019.jpg,Column
