title,link,premium,subhead,byline,image_url,article_type
French research thrown into turmoil by a multifaceted crisis,https://www.lemonde.fr/en/science/article/2026/06/28/french-research-thrown-into-turmoil-by-a-multifaceted-crisis_6754955_10.html,Subscribers only,"France's scientific community faces a host of challenges, from dwindling financial resources, ideological attacks and the emergence of artificial intelligence. The result is worrying for researchers nationwide, at a time when France is also slipping behind in scientific publishing.",,https://img.lemde.fr/2026/06/22/635/0/2681/1787/400/266/75/0/9419823_upload-1-vtcu2y3ao1ei-cnrsbudget-hd.jpg,
French firefighters brace for high-risk season after record heatwave,https://www.lemonde.fr/en/france/article/2026/06/28/french-firefighters-brace-for-a-high-risk-season-after-record-heatwave_6754952_7.html,Subscribers only,,,https://img.lemde.fr/2026/06/26/0/0/5852/3901/398/265/75/0/cf4ff90_upload-1-qjhcckgxm3y3-000-68by6nq.jpg,
"'Their mouths, eyes, hands, were taped and they were thrown into the hole': Russian soldiers confront Putin with reality of front lines",https://www.lemonde.fr/en/international/article/2026/06/28/their-mouths-eyes-hands-were-taped-and-they-were-thrown-into-the-hole-russian-soldiers-confront-putin-with-reality-of-front-lines_6754954_5.html,Subscribers only,,,https://img.lemde.fr/2026/06/25/673/0/4000/2666/398/265/75/0/68f1786_upload-1-on67o7s23kgh-008.JPG,
'The basic assumption is that men know': Bars showing the 2026 World Cup confront everyday sexism,https://www.lemonde.fr/en/sports/article/2026/06/28/the-basic-assumption-is-that-men-know-bars-showing-the-2026-world-cup-confront-everyday-sexism_6754956_9.html,Subscribers only,"During the World Cup, the organization Her Game Too is rolling out a system for reporting sexist and sexual violence in several bars across France. In Saint-Ouen, women describe the ways they are still forced to prove their legitimacy as football fans.",,https://img.lemde.fr/2026/06/27/312/0/1890/1260/398/265/75/0/893dde7_upload-1-ve6kcnxbmabx-010-millerand-5h9a4061.jpg,
"From France to Italy, inside the counterfeit rings circulating fake banknotes across Europe via social media",https://www.lemonde.fr/en/france/article/2026/06/28/from-france-to-italy-inside-the-counterfeit-rings-circulating-fake-banknotes-across-europe-via-social-media_6754949_7.html,Subscribers only,A joint French-Italian investigation that lasted over a year led to the indictment of 12 people suspected of belonging to a huge counterfeiting network.,,https://img.lemde.fr/2026/06/27/571/0/2362/1574/398/265/75/0/78018e4_upload-1-dft6rfrk9j6s-dessin-hd-vito-fait-des-faux-billets-lemonde.jpg,
250 years of American independence: The retreat from multiracial democracy,https://www.lemonde.fr/en/international/article/2026/06/28/250-years-of-american-independence-the-retreat-from-multiracial-democracy_6754953_4.html,Subscribers only,"'America 250' (7/13). A century after its founding, 38 states made up the nation. Deep divisions persisted over how to treat the Black population. Slavery had been abolished, much to the dismay of the Democrats, who were gaining ground. Although the Republicans won the presidential election, their victory came at the cost of institutionalizing segregationist policies in the Southern states.",,https://img.lemde.fr/2026/06/24/0/300/3240/2160/398/265/75/0/f31cf6b_upload-1-zk0gq5a3ozhv-capture-d-e-cran-2026-06-24-a-17-28-39-3.jpg,
To join the 'system' or overturn it? Far-right leader Bardella's private life and policies raise doubts,https://www.lemonde.fr/en/politics/article/2026/06/28/to-join-the-system-or-overturn-it-far-right-leader-bardella-s-private-life-and-policies-raise-doubts_6754951_5.html,Subscribers only,"By openly seeking to appeal to economic elites and the right, far-right leader Jordan Bardella breaks with Marine Le Pen and her father's historic 'anti-system' hostility. Some party members question his desire to pursue radical policies.",Clément Guillou,https://img.lemde.fr/2026/06/22/1/0/8192/5461/664/442/75/0/bb25d3c_upload-1-9d9bvj70aohr-abaca-1004299-010.jpg,News analysis
'Better an imperfect digital euro than no digital euro at all',https://www.lemonde.fr/en/opinion/article/2026/06/29/better-an-imperfect-digital-euro-than-no-digital-euro-at-all_6754958_23.html,Subscribers only,,,https://img.lemde.fr/2026/06/10/0/81/5277/3518/198/132/95/0/45399da_ftp-1-qk5hrkxhvujj-2026-06-10t230106z-273026667-rc2n58amd7d1-rtrmadp-3-ecb-policy.JPG,
France's deadliest ever general aviation accident: Skydiving plane crash kills 11,https://www.lemonde.fr/en/france/article/2026/06/28/civilian-plane-crash-kills-11-in-france_6754947_7.html,,,,https://img.lemde.fr/2026/06/28/0/0/7009/4672/198/132/95/0/4f173d2_upload-1-z5jqupejkgnf-demaxnewsspecialtwo649838.jpg,
'Our infrastructure was designed for a climate that no longer exists': France's unfinished reckoning with increasing heatwaves,https://www.lemonde.fr/en/france/article/2026/06/28/our-infrastructure-was-designed-for-a-climate-that-no-longer-exists-france-s-unfinished-reckoning-with-increasing-heatwaves_6754944_7.html,Subscribers only,,,https://img.lemde.fr/2026/06/27/0/89/2157/1438/198/132/95/0/c290e64_upload-1-fo1fmlio2ic0-000-par2003081351124.jpg,
Israel government recognizes Armenian genocide in rebuke to Turkey; Turkey denounces it as 'political',https://www.lemonde.fr/en/international/article/2026/06/28/israel-government-recognizes-armenian-genocide-in-rebuke-to-turkey_6754948_4.html,,,,https://img.lemde.fr/2024/12/05/0/0/4102/2735/198/132/95/0/dc1a326_c26ace0b1cba4abcbb32df2ea9cb2f71-0-918fb26d42a8462c821737eb93b4f992.jpg,
'Summer and extreme heat make all the symptoms worse': Coping with a heatwave and mental health conditions,https://www.lemonde.fr/en/france/article/2026/06/28/summer-and-extreme-heat-make-all-the-symptoms-worse-coping-with-a-heatwave-and-mental-health-conditions_6754943_7.html,Subscribers only,,,,
"2026 World Cup: In New York, football takes over the city where basketball is king",https://www.lemonde.fr/en/sports/article/2026/06/28/2026-world-cup-in-new-york-football-takes-over-the-city-where-basketball-is-king_6754950_9.html,Subscribers only,,,,
Martin Margiela puts 200 pieces from his personal archives up for sale,https://www.lemonde.fr/en/lifestyle/article/2026/06/28/martin-margiela-puts-200-pieces-from-his-personal-archives-up-for-sale_6754941_37.html,Subscribers only,,,,
'The King and the Mockingbird': The animated masterpiece that inspired Studio Ghibli,https://www.lemonde.fr/en/m-le-mag/article/2026/06/28/the-king-and-the-mockingbird-the-animated-masterpiece-that-inspired-studio-ghibli_6754945_117.html,Subscribers only,,,,
'I just want to know if he's still alive': The long ordeal of families searching for loved ones lost at sea,https://www.lemonde.fr/en/international/article/2026/06/28/i-just-want-to-know-if-he-s-still-alive-the-long-ordeal-of-families-searching-for-loved-ones-lost-at-sea_6754938_4.html,Subscribers only,,,,
"Dembélé shines at World Cup, silencing critics",https://www.lemonde.fr/en/sports/article/2026/06/27/dembele-shines-at-world-cup-silencing-critics_6754927_9.html,Subscribers only,,,,
Venezuelans call for help to rescue survivors from rubble after twin earthquakes,https://www.lemonde.fr/en/international/article/2026/06/27/venezuelans-call-for-help-to-rescue-survivors-from-rubble-after-twin-earthquakes_6754928_4.html,Subscribers only,,,,
Summer brings open-air cinema to Paris,https://www.lemonde.fr/en/culture/article/2026/06/28/summer-brings-open-air-cinema-to-paris_6754940_30.html,Subscribers only,,,,
"In the age of AI, Chinese universities overhaul their curricula",https://www.lemonde.fr/en/international/article/2026/06/26/in-the-age-of-ai-chinese-universities-overhaul-their-curricula_6754915_4.html,Subscribers only,"Universities across China are undergoing a major transformation to align with the economic priorities of the Chinese government and to tackle youth unemployment. To survive, some disciplines, such as foreign languages, now have to attach themselves to hard sciences.",Jordan Pouille,https://img.lemde.fr/2026/06/19/0/19/5818/3879/664/442/75/0/60e2c46_upload-1-g3ctftz68fkz-051-xxjpbee007051-20250624-pepfn0a001.jpg,Feature
Labor Minister Jean-Pierre Farandou: 'We cannot bring France to a halt every time it hits 30°C',https://www.lemonde.fr/en/politics/article/2026/06/27/jean-pierre-farandou-french-labor-minister-we-cannot-bring-france-to-a-halt-every-time-it-hits-30-c_6754916_5.html,Subscribers only,"With the intense heatwave exposing many workers to dangerous temperatures, the labor minister rejected the idea of climate leave, but said he was open to holding talks with unions and employers' organizations on how to better organize working conditions during extreme weather events.",Thibaud Métais,https://img.lemde.fr/2026/06/25/1059/0/3648/2432/664/442/75/0/1e3f27b_upload-1-oh1v1yvz3g1o-jlusseau-260420-le-monde-politique-farandou-18.jpg,Interview
Mansplashing: Why do men splash everyone at the pool?,https://www.lemonde.fr/en/france/article/2026/06/27/mansplashing-why-do-men-splash-everyone-at-the-pool_6754918_7.html,Subscribers only,"The behavior of the so-called 'pool man,' who thrashes around in the water and sprawls out across swimming lanes, highlights the power dynamics at play in the shared social space of the public swimming pool.",Nicolas Santolaria and  Rémy Jobic,https://img.lemde.fr/2026/06/24/692/0/2553/1702/664/442/75/0/09e7b64_upload-1-vqbhmgomdnj7-07-gettyimages-175008303.jpg,In Depth
'Is the Gulf Persian or Arabian? Or both?',https://www.lemonde.fr/en/international/article/2026/06/28/is-the-gulf-persian-or-arabian-or-both_6754946_4.html,Subscribe,,,https://img.lemde.fr/2023/07/31/0/0/0/0/100/100/60/0/d45bb07_1690791602941-eac5c14-1647333440018-jean-pierre-filiu-2019.jpg,Column
Trumpism gains ground in Latin America,https://www.lemonde.fr/en/opinion/article/2026/06/25/trumpism-gains-ground-in-latin-america_6754859_23.html,,,,,Editorial
'10th anniversary of Brexit referendum marks event long thought impossible in the UK: The rise of the far right',https://www.lemonde.fr/en/opinion/article/2026/06/23/10th-anniversary-of-brexit-referendum-marks-event-long-thought-impossible-in-the-uk-the-rise-of-the-far-right_6754771_23.html,Subscribe,,,https://img.lemde.fr/2025/02/13/0/0/0/0/100/100/60/0/e49d71b_sirius-fs-upload-1-hfccvvna5map-1739442970267-capture-da-a-cran-2025-02-13-113500.png,Column
