title,link,premium,subhead,byline,image_url,article_type
"French 'libertines' rapes case: From livestreams to camp sites, where the sexual crimes took place",https://www.lemonde.fr/en/france/article/2026/07/20/french-libertines-rapes-case-from-livestreams-to-camp-sites-where-the-sexual-crimes-took-place_6755660_7.html,Subscribers only,"Christophe B. and many other men he recruited are accused of raping women, with these sexual assaults broadcast online and in public. Responsibility is now being called into question. This is the final part of our investigation into the French 'libertines' rapes case.",,https://img.lemde.fr/2026/07/15/0/0/6378/4252/400/266/75/0/2659e9b_upload-1-nxlurhwkaspg-bordeaux-viols-def.jpg,
Andy Burnham becomes new UK PM after meeting King Charles,https://www.lemonde.fr/en/international/article/2026/07/20/andy-burnham-becomes-new-uk-pm-after-meeting-king-charles_6755651_4.html,,,,https://img.lemde.fr/2026/07/20/0/0/5376/3584/398/265/75/0/60c1f95_ftp-1-urdork4wol75-5666780-01-06.jpg,
Spain clinches second World Cup win after Argentina disappoints in final,https://www.lemonde.fr/en/sports/article/2026/07/20/2026-world-cup-spain-clinches-second-star-after-argentina-refuses-to-play-final_6755645_9.html,Subscribers only,,,https://img.lemde.fr/2026/07/19/0/0/4914/3276/398/265/75/0/1c47e8f_ftp-1-1wohppesfygx-5663435-01-06.jpg,
France denounces 'act of intimidation' against two of its diplomats in Iran,https://www.lemonde.fr/en/international/article/2026/07/20/france-denounces-act-of-intimidation-against-two-of-its-diplomats-in-iran_6755661_4.html,,"The pair were 'detained for several hours without reason, interrogated, and one of them was physically assaulted,' said French Foreign Minister Jean-Noël Barrot, adding that they were now safe and due to return to France within hours.",,https://img.lemde.fr/2026/04/27/0/0/3999/2666/398/265/75/0/f2cb0c2_ftp-1-m0p3wgv0zbkg-2026-04-27t154145z-1826496700-rc2rxka1oc74-rtrmadp-3-un-nuclear-npt.JPG,
"Amid 'megadeal' frenzy, global companies brush off geopolitical tensions",https://www.lemonde.fr/en/economy/article/2026/07/20/amid-megadeal-frenzy-global-companies-brush-off-geopolitical-tensions_6755659_19.html,Subscribers only,"The global mergers and acquisitions market jumped by 42% in the first half of the year, reaching $2.9 trillion, according to PitchBook. France also experienced this momentum.",,https://img.lemde.fr/2026/07/19/52/0/2144/1429/398/265/75/0/d2efcf6_upload-1-xf34vxssagnm-le-monde.jpg,
"Along Paris's Canal Saint-Martin, residents want the noise to stop",https://www.lemonde.fr/en/politics/article/2026/07/20/along-paris-s-canal-saint-martin-residents-want-the-noise-to-stop_6755658_5.html,Subscribers only,"Residents of this trendy neighborhood in the French capital have raised concerns for years about increasing noise disturbances, but political leaders have yet to provide a reassuring response.",,https://img.lemde.fr/2026/06/25/168/0/4000/2666/398/265/75/0/4e58f3a_upload-1-d22nqlpyepmu-raf-paris-canicule-nocturne-023.JPG,
"Cleanliness in Paris: Study reveals 1,412 spots left systematically unclean",https://www.lemonde.fr/en/politics/article/2026/07/20/cleanliness-in-paris-study-reveals-1-412-spots-left-systematically-unclean_6755662_5.html,Subscribers only,"Paris City Hall turned to architects and municipal cleaning workers to identify 1,412 'black spots,' small public spaces that are systematically soiled or clogged with bulky waste, which it aims to reduce to 1,000.",Hélène Bekmezian,https://img.lemde.fr/2026/07/10/1/0/7488/4992/664/442/75/0/a537272_upload-1-dikxytzafpim-000-a94l6eq.jpg,In Depth
Mexican drug lord 'El Mayo' sentenced by US court to life in prison,https://www.lemonde.fr/en/international/article/2026/07/20/mexican-drug-lord-el-mayo-sentenced-by-us-court-to-life-in-prison_6755663_4.html,,,,https://img.lemde.fr/2026/07/19/0/1/1942/1295/198/132/95/0/c10cce7_ftp-1-02kfbs16lboq-59e1c926c7b244df94663cc54da6637c-0-2462cded938c44ce9a2c001ebeebfbe1.jpg,
European Commission imposes record €550 million fine on AliExpress,https://www.lemonde.fr/en/economy/article/2026/07/20/european-commission-imposes-record-550-million-fine-on-aliexpress_6755655_19.html,Subscribers only,,,https://img.lemde.fr/2026/07/20/23/0/3133/2088/198/132/95/0/e0c2a07_upload-1-umbelurfeed1-051-xxjpbee007295-20231112-pepfn0a001.jpg,
Guinea asks France to return colonization-era looted manuscripts,https://www.lemonde.fr/en/international/article/2026/07/20/guinea-asks-france-to-return-colonization-era-looted-manuscripts_6755654_4.html,Subscribers only,,,https://img.lemde.fr/2026/07/16/312/0/877/584/198/132/95/0/a3ef054_upload-1-8qkrbk4mkazf-te-le-chargement.jpg,
Far-right Nigel Farage faces an unlikely opponent: Count Binface,https://www.lemonde.fr/en/international/article/2026/07/20/far-right-nigel-farage-faces-an-unlikely-opponent-count-binface_6755649_4.html,Subscribers only,,,https://img.lemde.fr/2026/07/19/0/0/6000/4000/198/132/95/0/1a7c8ba_upload-1-ypkx27boflk5-2026-06-19t014455z-1196404091-rc2owla3is3u-rtrmadp-3-britain-politics-makerfield.JPG,
German MP leader forced to resign after becoming a father via surrogacy,https://www.lemonde.fr/en/international/article/2026/07/20/german-mp-leader-forced-to-resign-after-becoming-a-father-via-surrogacy_6755647_4.html,Subscribers only,,,,
India's Cockroach movement supporters gather to attempt a march to Parliament,https://www.lemonde.fr/en/india/article/2026/07/20/india-s-cockroach-movement-supporters-gather-to-attempt-a-march-to-parliament_6755643_168.html,,,,,
US launches ninth night of strikes on Iran as it hits out at Gulf neighbors,https://www.lemonde.fr/en/international/article/2026/07/20/us-launches-ninth-night-of-strikes-on-iran-as-it-hits-out-at-gulf-neighbors_6755640_4.html,,,,,
Hundreds of thousands of Venezuelans need aid after earthquakes: 'We have no income left',https://www.lemonde.fr/en/international/article/2026/07/20/hundreds-of-thousands-of-venezuelans-need-aid-after-earthquakes-we-have-no-income-left_6755638_4.html,Subscribers only,,,,
Hungary's Magyar taps chess legend Judit Polgar for president,https://www.lemonde.fr/en/international/article/2026/07/20/hungary-s-magyar-taps-chess-legend-judit-polgar-for-president_6755648_4.html,,,,,
"Moscow region targeted by drones, at least two wounded",https://www.lemonde.fr/en/international/article/2026/07/20/moscow-region-targeted-by-drones-at-least-two-wounded_6755642_4.html,,,,,
An organic farmer's dismay at the speed of climate change: 'I thought I would have time to prepare',https://www.lemonde.fr/en/economy/article/2026/07/19/an-organic-farmer-s-dismay-at-the-speed-of-climate-change-i-thought-i-would-have-time-to-prepare_6755633_19.html,Subscribers only,,,,
"20 men, a 'sperm party,' and two days of sexual torment: The brutality of the 'libertine' rapes case",https://www.lemonde.fr/en/france/article/2026/07/19/20-men-a-sperm-party-and-two-days-of-sexual-torment-the-brutality-of-the-libertine-rapes-case_6755622_7.html,Subscribers only,,,,
France's must-see art exhibitions this summer,https://www.lemonde.fr/en/culture/article/2026/07/19/france-s-must-see-art-exhibitions-this-summer_6755615_30.html,Subscribers only,"Le Monde's critics present our selection of exhibitions on painting, contemporary art and photography across France.",,https://img.lemde.fr/2026/06/30/0/0/960/640/664/442/75/0/7c620db_upload-1-tnnb4we2voct-1f9859f2acf9603a859f2acf9b6a85v-960x640.jpg,Selection
"Alexander Skarsgård, a daring actor",https://www.lemonde.fr/en/m-le-mag/article/2026/07/19/alexander-skarsgard-a-daring-actor_6755628_117.html,Subscribers only,"The 49-year-old Swedish actor plays a gay, dominant biker in 'Pillion.' It's an unexpected role for Skarsgård, who is known for Hollywood blockbusters but is determined not to be typecast as a conventional heartthrob.",Clément Ghys,https://img.lemde.fr/2026/02/17/156/0/1500/1000/664/442/75/0/be30188_ftp-1-r0ia71hurfku-416941-3459171.jpg,Profile
"Inside the court of France's richest man, Bernard Arnault",https://www.lemonde.fr/en/summer-reads/article/2026/07/19/bernard-arnault-inside-the-court-of-france-s-richest-man_6755617_183.html,Subscribers only,'Bernard Arnault's Empire' (1/6). The billionaire at the head of LVMH is as secretive as he is powerful. He relies on a devoted entourage in which a mix of fear and admiration prevails.,Raphaëlle Bacqué and  Vanessa Schneider,https://img.lemde.fr/2026/07/16/1736/0/4000/2666/664/442/75/0/3630522_upload-1-tarby5yocvaj-l1070311.jpg,Investigation
Donald Trump and his troubling electoral obsessions,https://www.lemonde.fr/en/opinion/article/2026/07/18/donald-trump-and-his-troubling-electoral-obsessions_6755603_23.html,,,,,Editorial
"'We are trapped in a climate dystopia, a black comedy scenario, where the grotesque rivals the Orwellian farce'",https://www.lemonde.fr/en/opinion/article/2026/07/18/we-are-trapped-in-a-climate-dystopia-a-black-comedy-scenario-where-the-grotesque-rivals-the-orwellian-farce_6755609_23.html,Subscribe,,,,Column
"'Contemporary films about the Occupation of France are sounding alarm bells, with varying degrees of subtlety'",https://www.lemonde.fr/en/opinion/article/2026/07/17/contemporary-films-about-the-occupation-in-france-sound-alarm-bells-with-varying-degrees-of-subtlety_6755557_23.html,Subscribe,,,,Op-Ed
